{
    "id": "0176d2ca-6223-42f8-bf19-aeac7647676c",
    "name": "Candidate 17 from GlobalSolutions Inc.",
    "job_title": "Software Engineer",
    "industry": "Retail",
    "level": "Manager",
    "skills": [
        "Frontend Development",
        "AWS",
        "GCP",
        "SQL",
        "Cybersecurity",
        "Machine Learning"
    ],
    "raw_text": "Name: Candidate 17 from GlobalSolutions Inc.\nEmail: candidate.17.@example.com | Phone: (123) 555-0016\n\n**Summary:** A results-oriented and experienced Manager Software Engineer with 15 years in the Retail industry. Skilled in Frontend Development, AWS, GCP, SQL, Cybersecurity, Machine Learning. Adept at building scalable systems. strong problem-solving abilities and a collaborative mindset..\n\n**Experience:**\n**Acme Corp** - Software Engineer (14 years)\n  - Led 3 major projects, improving efficiency by 24%.\n  - Mentored junior team members and fostered a collaborative environment.\n  - Developed and deployed X, Y, and Z features using Frontend Development.\n**Global Innovations** - Associate Engineer (1 years)\n  - Contributed to 3 product releases.\n  - Performed data analysis using Machine Learning.\n\n**Education:** Bachelor's Degree in Computer Science from a well-regarded university."
}