{
    "id": "03215e92-9e21-40df-9149-24fc02d1e6d8",
    "name": "Candidate 83 from GlobalSolutions Inc.",
    "job_title": "Technical Lead",
    "industry": "Automotive",
    "level": "Director",
    "skills": [
        "AWS",
        "Machine Learning",
        "Blockchain",
        "Java"
    ],
    "raw_text": "Name: Candidate 83 from GlobalSolutions Inc.\nEmail: candidate.83.@example.com | Phone: (123) 555-0082\n\n**Summary:** A results-oriented and experienced Director Technical Lead with 7 years in the Automotive industry. Skilled in AWS, Machine Learning, Blockchain, Java. Adept at analyzing complex data. strong problem-solving abilities and a collaborative mindset..\n\n**Experience:**\n**Acme Corp** - Technical Lead (4 years)\n  - Led 1 major projects, improving efficiency by 38%.\n  - Mentored junior team members and fostered a collaborative environment.\n  - Developed and deployed X, Y, and Z features using Machine Learning.\n**Global Innovations** - Junior Lead (2 years)\n  - Contributed to 4 product releases.\n  - Performed data analysis using Machine Learning.\n\n**Education:** Bachelor's Degree in Business Administration from a well-regarded university."
}