{
    "id": "04b3c96c-6f39-4ecb-8045-9b45ff78e77e",
    "name": "Candidate 5 from GlobalSolutions Inc.",
    "job_title": "Sales Executive",
    "industry": "Biotech",
    "level": "Senior",
    "skills": [
        "DevOps",
        "Salesforce CRM",
        "AWS",
        "Marketing Strategy",
        "Project Management"
    ],
    "raw_text": "Name: Candidate 5 from GlobalSolutions Inc.\nEmail: candidate.5.@example.com | Phone: (123) 555-0004\n\n**Summary:** A results-oriented and experienced Senior Sales Executive with 6 years in the Biotech industry. Skilled in DevOps, Salesforce CRM, AWS, Marketing Strategy, Project Management. Adept at driving revenue growth. strong problem-solving abilities and a collaborative mindset..\n\n**Experience:**\n**Acme Corp** - Sales Executive (3 years)\n  - Led 3 major projects, improving efficiency by 33%.\n  - Mentored junior team members and fostered a collaborative environment.\n  - Developed and deployed X, Y, and Z features using AWS.\n**Global Innovations** - Associate Executive (3 years)\n  - Contributed to 2 product releases.\n  - Performed data analysis using Salesforce CRM.\n\n**Education:** Bachelor's Degree in Marketing from a well-regarded university."
}