{
    "id": "0890c9e0-e41d-4b14-846c-70a69ca459ed",
    "name": "Candidate 88 from GlobalSolutions Inc.",
    "job_title": "Business Analyst",
    "industry": "Manufacturing",
    "level": "Director",
    "skills": [
        "UI/UX Design",
        "Blockchain",
        "Machine Learning",
        "Data Analysis"
    ],
    "raw_text": "Name: Candidate 88 from GlobalSolutions Inc.\nEmail: candidate.88.@example.com | Phone: (123) 555-0087\n\n**Summary:** A results-oriented and experienced Director Business Analyst with 5 years in the Manufacturing industry. Skilled in UI/UX Design, Blockchain, Machine Learning, Data Analysis. Adept at analyzing complex data. strong problem-solving abilities and a collaborative mindset..\n\n**Experience:**\n**Acme Corp** - Business Analyst (3 years)\n  - Led 1 major projects, improving efficiency by 24%.\n  - Mentored junior team members and fostered a collaborative environment.\n  - Developed and deployed X, Y, and Z features using Data Analysis.\n**Global Innovations** - Associate Analyst (3 years)\n  - Contributed to 2 product releases.\n  - Performed data analysis using Machine Learning.\n\n**Education:** Bachelor's Degree in Finance from a well-regarded university."
}