{
    "id": "0b64f0b4-ff67-4b5a-b5a4-a06293c5b1b2",
    "name": "Candidate 71 from GlobalSolutions Inc.",
    "job_title": "Marketing Manager",
    "industry": "Retail",
    "level": "Lead",
    "skills": [
        "Sales Leadership",
        "Java",
        "GCP",
        "Product Management",
        "AWS",
        "Financial Modeling",
        "Machine Learning",
        "SQL"
    ],
    "raw_text": "Name: Candidate 71 from GlobalSolutions Inc.\nEmail: candidate.71.@example.com | Phone: (123) 555-0070\n\n**Summary:** A results-oriented and experienced Lead Marketing Manager with 2 years in the Retail industry. Skilled in Sales Leadership, Java, GCP, Product Management, AWS, Financial Modeling, Machine Learning, SQL. Adept at leading cross-functional teams. strong problem-solving abilities and a collaborative mindset..\n\n**Experience:**\n**Acme Corp** - Marketing Manager (1 years)\n  - Led 1 major projects, improving efficiency by 36%.\n  - Mentored junior team members and fostered a collaborative environment.\n  - Developed and deployed X, Y, and Z features using Java.\n**Global Innovations** - Associate Manager (1 years)\n  - Contributed to 3 product releases.\n  - Performed data analysis using Financial Modeling.\n\n**Education:** Bachelor's Degree in Finance from a well-regarded university."
}