{
    "id": "0cb9ca93-9864-44ce-acb7-9837531682b8",
    "name": "Candidate 47 from GlobalSolutions Inc.",
    "job_title": "DevOps Engineer",
    "industry": "Finance",
    "level": "Director",
    "skills": [
        "Financial Modeling",
        "Sales Leadership",
        "Azure",
        "Product Management",
        "UI/UX Design"
    ],
    "raw_text": "Name: Candidate 47 from GlobalSolutions Inc.\nEmail: candidate.47.@example.com | Phone: (123) 555-0046\n\n**Summary:** A results-oriented and experienced Director DevOps Engineer with 7 years in the Finance industry. Skilled in Financial Modeling, Sales Leadership, Azure, Product Management, UI/UX Design. Adept at building scalable systems. strong problem-solving abilities and a collaborative mindset..\n\n**Experience:**\n**Acme Corp** - DevOps Engineer (2 years)\n  - Led 2 major projects, improving efficiency by 30%.\n  - Mentored junior team members and fostered a collaborative environment.\n  - Developed and deployed X, Y, and Z features using Azure.\n**Global Innovations** - Junior Engineer (1 years)\n  - Contributed to 5 product releases.\n  - Performed data analysis using UI/UX Design.\n\n**Education:** Bachelor's Degree in Engineering from a well-regarded university."
}