{
    "id": "0f86c0b0-c539-48ef-86f4-07fa62623890",
    "name": "Candidate 66 from GlobalSolutions Inc.",
    "job_title": "Financial Analyst",
    "industry": "Biotech",
    "level": "Lead",
    "skills": [
        "Frontend Development",
        "Machine Learning",
        "Sales Leadership",
        "SAP ERP",
        "Python",
        "Financial Modeling",
        "Backend Development",
        "GCP"
    ],
    "raw_text": "Name: Candidate 66 from GlobalSolutions Inc.\nEmail: candidate.66.@example.com | Phone: (123) 555-0065\n\n**Summary:** A results-oriented and experienced Lead Financial Analyst with 7 years in the Biotech industry. Skilled in Frontend Development, Machine Learning, Sales Leadership, SAP ERP, Python, Financial Modeling, Backend Development, GCP. Adept at analyzing complex data. strong problem-solving abilities and a collaborative mindset..\n\n**Experience:**\n**Acme Corp** - Financial Analyst (5 years)\n  - Led 3 major projects, improving efficiency by 31%.\n  - Mentored junior team members and fostered a collaborative environment.\n  - Developed and deployed X, Y, and Z features using Sales Leadership.\n**Global Innovations** - Junior Analyst (2 years)\n  - Contributed to 2 product releases.\n  - Performed data analysis using Frontend Development.\n\n**Education:** Bachelor's Degree in Finance from a well-regarded university."
}