{
    "id": "1672be50-5323-462e-ab28-db855e57f5f2",
    "name": "Candidate 73 from GlobalSolutions Inc.",
    "job_title": "Software Engineer",
    "industry": "Finance",
    "level": "Mid",
    "skills": [
        "GCP",
        "Marketing Strategy",
        "Product Management",
        "Project Management",
        "Backend Development",
        "Azure",
        "HR Management",
        "Financial Modeling"
    ],
    "raw_text": "Name: Candidate 73 from GlobalSolutions Inc.\nEmail: candidate.73.@example.com | Phone: (123) 555-0072\n\n**Summary:** A results-oriented and experienced Mid Software Engineer with 5 years in the Finance industry. Skilled in GCP, Marketing Strategy, Product Management, Project Management, Backend Development, Azure, HR Management, Financial Modeling. Adept at building scalable systems. strong problem-solving abilities and a collaborative mindset..\n\n**Experience:**\n**Acme Corp** - Software Engineer (3 years)\n  - Led 1 major projects, improving efficiency by 21%.\n  - Mentored junior team members and fostered a collaborative environment.\n  - Developed and deployed X, Y, and Z features using Azure.\n**Global Innovations** - Associate Engineer (3 years)\n  - Contributed to 3 product releases.\n  - Performed data analysis using Marketing Strategy.\n\n**Education:** Bachelor's Degree in Marketing from a well-regarded university."
}