{
    "id": "18da2a16-2f4c-4aae-9efb-6164238816a0",
    "name": "Candidate 15 from GlobalSolutions Inc.",
    "job_title": "Technical Lead",
    "industry": "Automotive",
    "level": "Senior",
    "skills": [
        "Frontend Development",
        "Java",
        "Cybersecurity",
        "SAP ERP"
    ],
    "raw_text": "Name: Candidate 15 from GlobalSolutions Inc.\nEmail: candidate.15.@example.com | Phone: (123) 555-0014\n\n**Summary:** A results-oriented and experienced Senior Technical Lead with 12 years in the Automotive industry. Skilled in Frontend Development, Java, Cybersecurity, SAP ERP. Adept at analyzing complex data. strong problem-solving abilities and a collaborative mindset..\n\n**Experience:**\n**Acme Corp** - Technical Lead (11 years)\n  - Led 3 major projects, improving efficiency by 25%.\n  - Mentored junior team members and fostered a collaborative environment.\n  - Developed and deployed X, Y, and Z features using Cybersecurity.\n**Global Innovations** - Associate Lead (1 years)\n  - Contributed to 3 product releases.\n  - Performed data analysis using SAP ERP.\n\n**Education:** Bachelor's Degree in Engineering from a well-regarded university."
}