{
    "id": "19d78c62-2e3a-469e-b878-c060e46794d1",
    "name": "Candidate 57 from GlobalSolutions Inc.",
    "job_title": "Director of Engineering",
    "industry": "Finance",
    "level": "Director",
    "skills": [
        "SAP ERP",
        "Blockchain",
        "Financial Modeling",
        "Product Management",
        "Data Analysis",
        "AWS"
    ],
    "raw_text": "Name: Candidate 57 from GlobalSolutions Inc.\nEmail: candidate.57.@example.com | Phone: (123) 555-0056\n\n**Summary:** A results-oriented and experienced Director Director of Engineering with 5 years in the Finance industry. Skilled in SAP ERP, Blockchain, Financial Modeling, Product Management, Data Analysis, AWS. Adept at building scalable systems. strong problem-solving abilities and a collaborative mindset..\n\n**Experience:**\n**Acme Corp** - Director of Engineering (4 years)\n  - Led 2 major projects, improving efficiency by 20%.\n  - Mentored junior team members and fostered a collaborative environment.\n  - Developed and deployed X, Y, and Z features using Data Analysis.\n**Global Innovations** - Associate Engineering (1 years)\n  - Contributed to 5 product releases.\n  - Performed data analysis using Data Analysis.\n\n**Education:** Bachelor's Degree in Marketing from a well-regarded university."
}