{
    "id": "1bb380cd-f68b-4ba0-a063-5841641bc329",
    "name": "Candidate 45 from GlobalSolutions Inc.",
    "job_title": "Business Analyst",
    "industry": "SaaS",
    "level": "Lead",
    "skills": [
        "Java",
        "Sales Leadership",
        "Python",
        "Salesforce CRM",
        "DevOps"
    ],
    "raw_text": "Name: Candidate 45 from GlobalSolutions Inc.\nEmail: candidate.45.@example.com | Phone: (123) 555-0044\n\n**Summary:** A results-oriented and experienced Lead Business Analyst with 9 years in the SaaS industry. Skilled in Java, Sales Leadership, Python, Salesforce CRM, DevOps. Adept at analyzing complex data. strong problem-solving abilities and a collaborative mindset..\n\n**Experience:**\n**Acme Corp** - Business Analyst (1 years)\n  - Led 2 major projects, improving efficiency by 21%.\n  - Mentored junior team members and fostered a collaborative environment.\n  - Developed and deployed X, Y, and Z features using Sales Leadership.\n**Global Innovations** - Associate Analyst (3 years)\n  - Contributed to 4 product releases.\n  - Performed data analysis using Salesforce CRM.\n\n**Education:** Bachelor's Degree in Finance from a well-regarded university."
}