{
    "id": "1d7e899d-6f8e-499f-baff-a35456953b8e",
    "name": "Candidate 10 from GlobalSolutions Inc.",
    "job_title": "Marketing Manager",
    "industry": "Healthcare",
    "level": "Mid",
    "skills": [
        "Machine Learning",
        "DevOps",
        "Project Management",
        "UI/UX Design",
        "Python",
        "Sales Leadership",
        "Data Analysis",
        "Backend Development"
    ],
    "raw_text": "Name: Candidate 10 from GlobalSolutions Inc.\nEmail: candidate.10.@example.com | Phone: (123) 555-0009\n\n**Summary:** A results-oriented and experienced Mid Marketing Manager with 8 years in the Healthcare industry. Skilled in Machine Learning, DevOps, Project Management, UI/UX Design, Python, Sales Leadership, Data Analysis, Backend Development. Adept at leading cross-functional teams. strong problem-solving abilities and a collaborative mindset..\n\n**Experience:**\n**Acme Corp** - Marketing Manager (7 years)\n  - Led 2 major projects, improving efficiency by 37%.\n  - Mentored junior team members and fostered a collaborative environment.\n  - Developed and deployed X, Y, and Z features using DevOps.\n**Global Innovations** - Junior Manager (3 years)\n  - Contributed to 4 product releases.\n  - Performed data analysis using Backend Development.\n\n**Education:** Bachelor's Degree in Computer Science from a well-regarded university."
}