{
    "id": "2634c5a2-4d2b-4245-af13-3910bd5382ad",
    "name": "Candidate 90 from GlobalSolutions Inc.",
    "job_title": "DevOps Engineer",
    "industry": "Biotech",
    "level": "Mid",
    "skills": [
        "Azure",
        "AWS",
        "Cybersecurity"
    ],
    "raw_text": "Name: Candidate 90 from GlobalSolutions Inc.\nEmail: candidate.90.@example.com | Phone: (123) 555-0089\n\n**Summary:** A results-oriented and experienced Mid DevOps Engineer with 15 years in the Biotech industry. Skilled in Azure, AWS, Cybersecurity. Adept at building scalable systems. strong problem-solving abilities and a collaborative mindset..\n\n**Experience:**\n**Acme Corp** - DevOps Engineer (4 years)\n  - Led 1 major projects, improving efficiency by 30%.\n  - Mentored junior team members and fostered a collaborative environment.\n  - Developed and deployed X, Y, and Z features using AWS.\n**Global Innovations** - Associate Engineer (2 years)\n  - Contributed to 4 product releases.\n  - Performed data analysis using Azure.\n\n**Education:** Bachelor's Degree in Finance from a well-regarded university."
}