{
    "id": "288b0bea-60e0-4b78-a701-9064f78f456a",
    "name": "Candidate 3 from GlobalSolutions Inc.",
    "job_title": "Financial Analyst",
    "industry": "Healthcare",
    "level": "Lead",
    "skills": [
        "Java",
        "Project Management",
        "SQL",
        "DevOps",
        "Salesforce CRM",
        "Blockchain",
        "Frontend Development"
    ],
    "raw_text": "Name: Candidate 3 from GlobalSolutions Inc.\nEmail: candidate.3.@example.com | Phone: (123) 555-0002\n\n**Summary:** A results-oriented and experienced Lead Financial Analyst with 5 years in the Healthcare industry. Skilled in Java, Project Management, SQL, DevOps, Salesforce CRM, Blockchain, Frontend Development. Adept at analyzing complex data. strong problem-solving abilities and a collaborative mindset..\n\n**Experience:**\n**Acme Corp** - Financial Analyst (2 years)\n  - Led 2 major projects, improving efficiency by 38%.\n  - Mentored junior team members and fostered a collaborative environment.\n  - Developed and deployed X, Y, and Z features using DevOps.\n**Global Innovations** - Junior Analyst (2 years)\n  - Contributed to 4 product releases.\n  - Performed data analysis using Project Management.\n\n**Education:** Bachelor's Degree in Business Administration from a well-regarded university."
}