{
    "id": "34f2f8ef-dfe4-43b4-8375-341149b3b384",
    "name": "Candidate 29 from GlobalSolutions Inc.",
    "job_title": "Product Manager",
    "industry": "Finance",
    "level": "Junior",
    "skills": [
        "Machine Learning",
        "Product Management",
        "Java",
        "GCP",
        "SAP ERP",
        "Data Analysis"
    ],
    "raw_text": "Name: Candidate 29 from GlobalSolutions Inc.\nEmail: candidate.29.@example.com | Phone: (123) 555-0028\n\n**Summary:** A results-oriented and experienced Junior Product Manager with 9 years in the Finance industry. Skilled in Machine Learning, Product Management, Java, GCP, SAP ERP, Data Analysis. Adept at leading cross-functional teams. strong problem-solving abilities and a collaborative mindset..\n\n**Experience:**\n**Acme Corp** - Product Manager (8 years)\n  - Led 2 major projects, improving efficiency by 29%.\n  - Mentored junior team members and fostered a collaborative environment.\n  - Developed and deployed X, Y, and Z features using GCP.\n**Global Innovations** - Associate Manager (2 years)\n  - Contributed to 3 product releases.\n  - Performed data analysis using Data Analysis.\n\n**Education:** Bachelor's Degree in Computer Science from a well-regarded university."
}