{
    "id": "352771cf-e35a-42a1-8ed5-d2494d0262cd",
    "name": "Candidate 31 from GlobalSolutions Inc.",
    "job_title": "Director of Engineering",
    "industry": "Manufacturing",
    "level": "Manager",
    "skills": [
        "Marketing Strategy",
        "Backend Development",
        "Financial Modeling",
        "Data Analysis",
        "Azure",
        "GCP",
        "Blockchain",
        "Cybersecurity"
    ],
    "raw_text": "Name: Candidate 31 from GlobalSolutions Inc.\nEmail: candidate.31.@example.com | Phone: (123) 555-0030\n\n**Summary:** A results-oriented and experienced Manager Director of Engineering with 3 years in the Manufacturing industry. Skilled in Marketing Strategy, Backend Development, Financial Modeling, Data Analysis, Azure, GCP, Blockchain, Cybersecurity. Adept at building scalable systems. strong problem-solving abilities and a collaborative mindset..\n\n**Experience:**\n**Acme Corp** - Director of Engineering (2 years)\n  - Led 3 major projects, improving efficiency by 21%.\n  - Mentored junior team members and fostered a collaborative environment.\n  - Developed and deployed X, Y, and Z features using Data Analysis.\n**Global Innovations** - Junior Engineering (1 years)\n  - Contributed to 5 product releases.\n  - Performed data analysis using Blockchain.\n\n**Education:** Bachelor's Degree in Business Administration from a well-regarded university."
}