{
    "id": "45c5dbe8-06c9-481c-8419-a712c0cdea50",
    "name": "Candidate 46 from GlobalSolutions Inc.",
    "job_title": "Financial Analyst",
    "industry": "Biotech",
    "level": "Junior",
    "skills": [
        "Azure",
        "Financial Modeling",
        "GCP",
        "Cybersecurity",
        "Machine Learning",
        "Java"
    ],
    "raw_text": "Name: Candidate 46 from GlobalSolutions Inc.\nEmail: candidate.46.@example.com | Phone: (123) 555-0045\n\n**Summary:** A results-oriented and experienced Junior Financial Analyst with 10 years in the Biotech industry. Skilled in Azure, Financial Modeling, GCP, Cybersecurity, Machine Learning, Java. Adept at analyzing complex data. strong problem-solving abilities and a collaborative mindset..\n\n**Experience:**\n**Acme Corp** - Financial Analyst (2 years)\n  - Led 3 major projects, improving efficiency by 24%.\n  - Mentored junior team members and fostered a collaborative environment.\n  - Developed and deployed X, Y, and Z features using Cybersecurity.\n**Global Innovations** - Associate Analyst (1 years)\n  - Contributed to 5 product releases.\n  - Performed data analysis using Machine Learning.\n\n**Education:** Bachelor's Degree in Computer Science from a well-regarded university."
}