{
    "id": "46d425e9-25bc-4f8e-ae52-db6387195d18",
    "name": "Candidate 80 from GlobalSolutions Inc.",
    "job_title": "Business Analyst",
    "industry": "Finance",
    "level": "Mid",
    "skills": [
        "UI/UX Design",
        "HR Management",
        "Java"
    ],
    "raw_text": "Name: Candidate 80 from GlobalSolutions Inc.\nEmail: candidate.80.@example.com | Phone: (123) 555-0079\n\n**Summary:** A results-oriented and experienced Mid Business Analyst with 4 years in the Finance industry. Skilled in UI/UX Design, HR Management, Java. Adept at analyzing complex data. strong problem-solving abilities and a collaborative mindset..\n\n**Experience:**\n**Acme Corp** - Business Analyst (3 years)\n  - Led 2 major projects, improving efficiency by 11%.\n  - Mentored junior team members and fostered a collaborative environment.\n  - Developed and deployed X, Y, and Z features using UI/UX Design.\n**Global Innovations** - Associate Analyst (2 years)\n  - Contributed to 3 product releases.\n  - Performed data analysis using UI/UX Design.\n\n**Education:** Bachelor's Degree in Business Administration from a well-regarded university."
}