{
    "id": "4946edc5-b8b6-4443-9ad5-a0280987a568",
    "name": "Candidate 53 from GlobalSolutions Inc.",
    "job_title": "Data Scientist",
    "industry": "Healthcare",
    "level": "Manager",
    "skills": [
        "Cybersecurity",
        "Machine Learning",
        "SQL"
    ],
    "raw_text": "Name: Candidate 53 from GlobalSolutions Inc.\nEmail: candidate.53.@example.com | Phone: (123) 555-0052\n\n**Summary:** A results-oriented and experienced Manager Data Scientist with 10 years in the Healthcare industry. Skilled in Cybersecurity, Machine Learning, SQL. Adept at analyzing complex data. strong problem-solving abilities and a collaborative mindset..\n\n**Experience:**\n**Acme Corp** - Data Scientist (4 years)\n  - Led 3 major projects, improving efficiency by 23%.\n  - Mentored junior team members and fostered a collaborative environment.\n  - Developed and deployed X, Y, and Z features using Cybersecurity.\n**Global Innovations** - Junior Scientist (1 years)\n  - Contributed to 2 product releases.\n  - Performed data analysis using Cybersecurity.\n\n**Education:** Bachelor's Degree in Finance from a well-regarded university."
}