{
    "id": "4962fb02-c425-4b69-aafe-614dddb33b45",
    "name": "Candidate 81 from GlobalSolutions Inc.",
    "job_title": "Product Manager",
    "industry": "E-commerce",
    "level": "Lead",
    "skills": [
        "Project Management",
        "Python",
        "Azure",
        "Frontend Development",
        "Salesforce CRM",
        "Backend Development",
        "Sales Leadership",
        "Product Management"
    ],
    "raw_text": "Name: Candidate 81 from GlobalSolutions Inc.\nEmail: candidate.81.@example.com | Phone: (123) 555-0080\n\n**Summary:** A results-oriented and experienced Lead Product Manager with 2 years in the E-commerce industry. Skilled in Project Management, Python, Azure, Frontend Development, Salesforce CRM, Backend Development, Sales Leadership, Product Management. Adept at leading cross-functional teams. strong problem-solving abilities and a collaborative mindset..\n\n**Experience:**\n**Acme Corp** - Product Manager (1 years)\n  - Led 3 major projects, improving efficiency by 34%.\n  - Mentored junior team members and fostered a collaborative environment.\n  - Developed and deployed X, Y, and Z features using Python.\n**Global Innovations** - Junior Manager (2 years)\n  - Contributed to 5 product releases.\n  - Performed data analysis using Azure.\n\n**Education:** Bachelor's Degree in Finance from a well-regarded university."
}