{
    "id": "49d088d1-2401-42d0-b2e1-af83515553a6",
    "name": "Candidate 42 from GlobalSolutions Inc.",
    "job_title": "Technical Lead",
    "industry": "Retail",
    "level": "Junior",
    "skills": [
        "Marketing Strategy",
        "Backend Development",
        "Azure"
    ],
    "raw_text": "Name: Candidate 42 from GlobalSolutions Inc.\nEmail: candidate.42.@example.com | Phone: (123) 555-0041\n\n**Summary:** A results-oriented and experienced Junior Technical Lead with 7 years in the Retail industry. Skilled in Marketing Strategy, Backend Development, Azure. Adept at analyzing complex data. strong problem-solving abilities and a collaborative mindset..\n\n**Experience:**\n**Acme Corp** - Technical Lead (3 years)\n  - Led 2 major projects, improving efficiency by 24%.\n  - Mentored junior team members and fostered a collaborative environment.\n  - Developed and deployed X, Y, and Z features using Backend Development.\n**Global Innovations** - Junior Lead (3 years)\n  - Contributed to 2 product releases.\n  - Performed data analysis using Backend Development.\n\n**Education:** Bachelor's Degree in Marketing from a well-regarded university."
}