{
    "id": "4b317817-37e8-4546-802c-f442377573d4",
    "name": "Candidate 78 from GlobalSolutions Inc.",
    "job_title": "VP of Sales",
    "industry": "Automotive",
    "level": "Director",
    "skills": [
        "Sales Leadership",
        "Data Analysis",
        "Product Management",
        "HR Management",
        "GCP",
        "Python",
        "UI/UX Design",
        "SQL"
    ],
    "raw_text": "Name: Candidate 78 from GlobalSolutions Inc.\nEmail: candidate.78.@example.com | Phone: (123) 555-0077\n\n**Summary:** A results-oriented and experienced Director VP of Sales with 8 years in the Automotive industry. Skilled in Sales Leadership, Data Analysis, Product Management, HR Management, GCP, Python, UI/UX Design, SQL. Adept at driving revenue growth. strong problem-solving abilities and a collaborative mindset..\n\n**Experience:**\n**Acme Corp** - VP of Sales (3 years)\n  - Led 3 major projects, improving efficiency by 39%.\n  - Mentored junior team members and fostered a collaborative environment.\n  - Developed and deployed X, Y, and Z features using Data Analysis.\n**Global Innovations** - Associate Sales (3 years)\n  - Contributed to 3 product releases.\n  - Performed data analysis using GCP.\n\n**Education:** Bachelor's Degree in Engineering from a well-regarded university."
}