{
    "id": "4b82e71b-5790-4594-bdda-40cce6e8f394",
    "name": "Candidate 32 from GlobalSolutions Inc.",
    "job_title": "Sales Executive",
    "industry": "SaaS",
    "level": "Director",
    "skills": [
        "Financial Modeling",
        "Python",
        "SQL",
        "UI/UX Design",
        "Product Management",
        "Sales Leadership",
        "Machine Learning",
        "Salesforce CRM"
    ],
    "raw_text": "Name: Candidate 32 from GlobalSolutions Inc.\nEmail: candidate.32.@example.com | Phone: (123) 555-0031\n\n**Summary:** A results-oriented and experienced Director Sales Executive with 12 years in the SaaS industry. Skilled in Financial Modeling, Python, SQL, UI/UX Design, Product Management, Sales Leadership, Machine Learning, Salesforce CRM. Adept at driving revenue growth. strong problem-solving abilities and a collaborative mindset..\n\n**Experience:**\n**Acme Corp** - Sales Executive (6 years)\n  - Led 2 major projects, improving efficiency by 37%.\n  - Mentored junior team members and fostered a collaborative environment.\n  - Developed and deployed X, Y, and Z features using Salesforce CRM.\n**Global Innovations** - Junior Executive (2 years)\n  - Contributed to 5 product releases.\n  - Performed data analysis using Machine Learning.\n\n**Education:** Bachelor's Degree in Business Administration from a well-regarded university."
}