{
    "id": "4b9e959b-25a3-433e-ba4a-057f5acad12b",
    "name": "Candidate 87 from GlobalSolutions Inc.",
    "job_title": "Director of Engineering",
    "industry": "Biotech",
    "level": "Junior",
    "skills": [
        "Blockchain",
        "Machine Learning",
        "SAP ERP"
    ],
    "raw_text": "Name: Candidate 87 from GlobalSolutions Inc.\nEmail: candidate.87.@example.com | Phone: (123) 555-0086\n\n**Summary:** A results-oriented and experienced Junior Director of Engineering with 7 years in the Biotech industry. Skilled in Blockchain, Machine Learning, SAP ERP. Adept at building scalable systems. strong problem-solving abilities and a collaborative mindset..\n\n**Experience:**\n**Acme Corp** - Director of Engineering (2 years)\n  - Led 3 major projects, improving efficiency by 28%.\n  - Mentored junior team members and fostered a collaborative environment.\n  - Developed and deployed X, Y, and Z features using Machine Learning.\n**Global Innovations** - Junior Engineering (1 years)\n  - Contributed to 2 product releases.\n  - Performed data analysis using SAP ERP.\n\n**Education:** Bachelor's Degree in Computer Science from a well-regarded university."
}