{
    "id": "4d9ff8de-3393-47a3-bb10-09cbc45c281c",
    "name": "Candidate 98 from GlobalSolutions Inc.",
    "job_title": "Data Scientist",
    "industry": "Retail",
    "level": "Senior",
    "skills": [
        "Product Management",
        "Backend Development",
        "Sales Leadership"
    ],
    "raw_text": "Name: Candidate 98 from GlobalSolutions Inc.\nEmail: candidate.98.@example.com | Phone: (123) 555-0097\n\n**Summary:** A results-oriented and experienced Senior Data Scientist with 5 years in the Retail industry. Skilled in Product Management, Backend Development, Sales Leadership. Adept at analyzing complex data. strong problem-solving abilities and a collaborative mindset..\n\n**Experience:**\n**Acme Corp** - Data Scientist (4 years)\n  - Led 3 major projects, improving efficiency by 20%.\n  - Mentored junior team members and fostered a collaborative environment.\n  - Developed and deployed X, Y, and Z features using Product Management.\n**Global Innovations** - Junior Scientist (1 years)\n  - Contributed to 2 product releases.\n  - Performed data analysis using Sales Leadership.\n\n**Education:** Bachelor's Degree in Marketing from a well-regarded university."
}