{
    "id": "4e1cc5e5-3dc7-41da-945c-aaf4ea7be1bf",
    "name": "Candidate 92 from GlobalSolutions Inc.",
    "job_title": "Marketing Manager",
    "industry": "Biotech",
    "level": "Mid",
    "skills": [
        "AWS",
        "Product Management",
        "Blockchain"
    ],
    "raw_text": "Name: Candidate 92 from GlobalSolutions Inc.\nEmail: candidate.92.@example.com | Phone: (123) 555-0091\n\n**Summary:** A results-oriented and experienced Mid Marketing Manager with 13 years in the Biotech industry. Skilled in AWS, Product Management, Blockchain. Adept at leading cross-functional teams. strong problem-solving abilities and a collaborative mindset..\n\n**Experience:**\n**Acme Corp** - Marketing Manager (4 years)\n  - Led 1 major projects, improving efficiency by 22%.\n  - Mentored junior team members and fostered a collaborative environment.\n  - Developed and deployed X, Y, and Z features using Blockchain.\n**Global Innovations** - Associate Manager (3 years)\n  - Contributed to 5 product releases.\n  - Performed data analysis using Blockchain.\n\n**Education:** Bachelor's Degree in Business Administration from a well-regarded university."
}