{
    "id": "4f2a328d-ccbb-4ab8-9be0-5745a71e929d",
    "name": "Candidate 85 from GlobalSolutions Inc.",
    "job_title": "Product Manager",
    "industry": "Tech",
    "level": "Lead",
    "skills": [
        "SQL",
        "AWS",
        "Salesforce CRM",
        "UI/UX Design",
        "DevOps",
        "Project Management",
        "Machine Learning",
        "GCP"
    ],
    "raw_text": "Name: Candidate 85 from GlobalSolutions Inc.\nEmail: candidate.85.@example.com | Phone: (123) 555-0084\n\n**Summary:** A results-oriented and experienced Lead Product Manager with 14 years in the Tech industry. Skilled in SQL, AWS, Salesforce CRM, UI/UX Design, DevOps, Project Management, Machine Learning, GCP. Adept at leading cross-functional teams. strong problem-solving abilities and a collaborative mindset..\n\n**Experience:**\n**Acme Corp** - Product Manager (7 years)\n  - Led 3 major projects, improving efficiency by 16%.\n  - Mentored junior team members and fostered a collaborative environment.\n  - Developed and deployed X, Y, and Z features using Salesforce CRM.\n**Global Innovations** - Junior Manager (3 years)\n  - Contributed to 3 product releases.\n  - Performed data analysis using UI/UX Design.\n\n**Education:** Bachelor's Degree in Finance from a well-regarded university."
}