{
    "id": "4f9dfee8-ec45-4ae8-a055-00f216fe8aca",
    "name": "Candidate 44 from GlobalSolutions Inc.",
    "job_title": "UX Designer",
    "industry": "Automotive",
    "level": "Lead",
    "skills": [
        "Data Analysis",
        "SAP ERP",
        "Sales Leadership",
        "AWS",
        "GCP",
        "DevOps",
        "Salesforce CRM",
        "Financial Modeling"
    ],
    "raw_text": "Name: Candidate 44 from GlobalSolutions Inc.\nEmail: candidate.44.@example.com | Phone: (123) 555-0043\n\n**Summary:** A results-oriented and experienced Lead UX Designer with 6 years in the Automotive industry. Skilled in Data Analysis, SAP ERP, Sales Leadership, AWS, GCP, DevOps, Salesforce CRM, Financial Modeling. Adept at analyzing complex data. strong problem-solving abilities and a collaborative mindset..\n\n**Experience:**\n**Acme Corp** - UX Designer (3 years)\n  - Led 2 major projects, improving efficiency by 10%.\n  - Mentored junior team members and fostered a collaborative environment.\n  - Developed and deployed X, Y, and Z features using GCP.\n**Global Innovations** - Associate Designer (1 years)\n  - Contributed to 5 product releases.\n  - Performed data analysis using Financial Modeling.\n\n**Education:** Bachelor's Degree in Finance from a well-regarded university."
}