{
    "id": "51239a53-13e2-4c42-9cb3-74e8ef68da9b",
    "name": "Candidate 40 from GlobalSolutions Inc.",
    "job_title": "Marketing Manager",
    "industry": "Healthcare",
    "level": "Lead",
    "skills": [
        "Backend Development",
        "AWS",
        "Java",
        "SAP ERP",
        "Cybersecurity",
        "Financial Modeling"
    ],
    "raw_text": "Name: Candidate 40 from GlobalSolutions Inc.\nEmail: candidate.40.@example.com | Phone: (123) 555-0039\n\n**Summary:** A results-oriented and experienced Lead Marketing Manager with 12 years in the Healthcare industry. Skilled in Backend Development, AWS, Java, SAP ERP, Cybersecurity, Financial Modeling. Adept at leading cross-functional teams. strong problem-solving abilities and a collaborative mindset..\n\n**Experience:**\n**Acme Corp** - Marketing Manager (6 years)\n  - Led 3 major projects, improving efficiency by 29%.\n  - Mentored junior team members and fostered a collaborative environment.\n  - Developed and deployed X, Y, and Z features using Java.\n**Global Innovations** - Associate Manager (2 years)\n  - Contributed to 3 product releases.\n  - Performed data analysis using Java.\n\n**Education:** Bachelor's Degree in Finance from a well-regarded university."
}