{
    "id": "52894f3b-5b30-47ff-976b-a4e9cdc38b04",
    "name": "Candidate 54 from GlobalSolutions Inc.",
    "job_title": "Marketing Manager",
    "industry": "Healthcare",
    "level": "Manager",
    "skills": [
        "Project Management",
        "Java",
        "AWS"
    ],
    "raw_text": "Name: Candidate 54 from GlobalSolutions Inc.\nEmail: candidate.54.@example.com | Phone: (123) 555-0053\n\n**Summary:** A results-oriented and experienced Manager Marketing Manager with 2 years in the Healthcare industry. Skilled in Project Management, Java, AWS. Adept at leading cross-functional teams. strong problem-solving abilities and a collaborative mindset..\n\n**Experience:**\n**Acme Corp** - Marketing Manager (1 years)\n  - Led 2 major projects, improving efficiency by 29%.\n  - Mentored junior team members and fostered a collaborative environment.\n  - Developed and deployed X, Y, and Z features using AWS.\n**Global Innovations** - Associate Manager (1 years)\n  - Contributed to 2 product releases.\n  - Performed data analysis using Project Management.\n\n**Education:** Bachelor's Degree in Business Administration from a well-regarded university."
}