{
    "id": "53225426-83a1-466a-b4ed-f222aa7f011a",
    "name": "Candidate 84 from GlobalSolutions Inc.",
    "job_title": "Data Scientist",
    "industry": "Tech",
    "level": "Junior",
    "skills": [
        "Azure",
        "AWS",
        "GCP"
    ],
    "raw_text": "Name: Candidate 84 from GlobalSolutions Inc.\nEmail: candidate.84.@example.com | Phone: (123) 555-0083\n\n**Summary:** A results-oriented and experienced Junior Data Scientist with 5 years in the Tech industry. Skilled in Azure, AWS, GCP. Adept at analyzing complex data. strong problem-solving abilities and a collaborative mindset..\n\n**Experience:**\n**Acme Corp** - Data Scientist (4 years)\n  - Led 2 major projects, improving efficiency by 40%.\n  - Mentored junior team members and fostered a collaborative environment.\n  - Developed and deployed X, Y, and Z features using Azure.\n**Global Innovations** - Junior Scientist (3 years)\n  - Contributed to 5 product releases.\n  - Performed data analysis using AWS.\n\n**Education:** Bachelor's Degree in Business Administration from a well-regarded university."
}