{
    "id": "54c94871-127a-4b41-bf43-422d71f993fa",
    "name": "Candidate 79 from GlobalSolutions Inc.",
    "job_title": "Product Manager",
    "industry": "Retail",
    "level": "Senior",
    "skills": [
        "Marketing Strategy",
        "DevOps",
        "Machine Learning",
        "Project Management",
        "GCP",
        "SAP ERP",
        "Financial Modeling",
        "Salesforce CRM"
    ],
    "raw_text": "Name: Candidate 79 from GlobalSolutions Inc.\nEmail: candidate.79.@example.com | Phone: (123) 555-0078\n\n**Summary:** A results-oriented and experienced Senior Product Manager with 4 years in the Retail industry. Skilled in Marketing Strategy, DevOps, Machine Learning, Project Management, GCP, SAP ERP, Financial Modeling, Salesforce CRM. Adept at leading cross-functional teams. strong problem-solving abilities and a collaborative mindset..\n\n**Experience:**\n**Acme Corp** - Product Manager (2 years)\n  - Led 2 major projects, improving efficiency by 32%.\n  - Mentored junior team members and fostered a collaborative environment.\n  - Developed and deployed X, Y, and Z features using Salesforce CRM.\n**Global Innovations** - Associate Manager (2 years)\n  - Contributed to 3 product releases.\n  - Performed data analysis using Financial Modeling.\n\n**Education:** Bachelor's Degree in Computer Science from a well-regarded university."
}