{
    "id": "58a9b319-ac1d-47f5-a253-a75e93d0e58a",
    "name": "Candidate 74 from GlobalSolutions Inc.",
    "job_title": "Director of Engineering",
    "industry": "Automotive",
    "level": "Director",
    "skills": [
        "SQL",
        "Data Analysis",
        "Marketing Strategy",
        "Product Management"
    ],
    "raw_text": "Name: Candidate 74 from GlobalSolutions Inc.\nEmail: candidate.74.@example.com | Phone: (123) 555-0073\n\n**Summary:** A results-oriented and experienced Director Director of Engineering with 10 years in the Automotive industry. Skilled in SQL, Data Analysis, Marketing Strategy, Product Management. Adept at building scalable systems. strong problem-solving abilities and a collaborative mindset..\n\n**Experience:**\n**Acme Corp** - Director of Engineering (2 years)\n  - Led 2 major projects, improving efficiency by 33%.\n  - Mentored junior team members and fostered a collaborative environment.\n  - Developed and deployed X, Y, and Z features using Product Management.\n**Global Innovations** - Junior Engineering (2 years)\n  - Contributed to 5 product releases.\n  - Performed data analysis using SQL.\n\n**Education:** Bachelor's Degree in Business Administration from a well-regarded university."
}