{
    "id": "5a72baf4-d787-40c3-ac64-831ebbc23ef3",
    "name": "Candidate 39 from GlobalSolutions Inc.",
    "job_title": "Data Scientist",
    "industry": "Automotive",
    "level": "Manager",
    "skills": [
        "Backend Development",
        "Sales Leadership",
        "Machine Learning",
        "Financial Modeling",
        "Azure"
    ],
    "raw_text": "Name: Candidate 39 from GlobalSolutions Inc.\nEmail: candidate.39.@example.com | Phone: (123) 555-0038\n\n**Summary:** A results-oriented and experienced Manager Data Scientist with 9 years in the Automotive industry. Skilled in Backend Development, Sales Leadership, Machine Learning, Financial Modeling, Azure. Adept at analyzing complex data. strong problem-solving abilities and a collaborative mindset..\n\n**Experience:**\n**Acme Corp** - Data Scientist (3 years)\n  - Led 1 major projects, improving efficiency by 23%.\n  - Mentored junior team members and fostered a collaborative environment.\n  - Developed and deployed X, Y, and Z features using Backend Development.\n**Global Innovations** - Associate Scientist (2 years)\n  - Contributed to 5 product releases.\n  - Performed data analysis using Sales Leadership.\n\n**Education:** Bachelor's Degree in Finance from a well-regarded university."
}