{
    "id": "5de22075-cc1b-41b1-bf57-1556088f9f32",
    "name": "Candidate 25 from GlobalSolutions Inc.",
    "job_title": "Business Analyst",
    "industry": "Retail",
    "level": "Lead",
    "skills": [
        "Financial Modeling",
        "HR Management",
        "Frontend Development",
        "AWS",
        "Azure"
    ],
    "raw_text": "Name: Candidate 25 from GlobalSolutions Inc.\nEmail: candidate.25.@example.com | Phone: (123) 555-0024\n\n**Summary:** A results-oriented and experienced Lead Business Analyst with 13 years in the Retail industry. Skilled in Financial Modeling, HR Management, Frontend Development, AWS, Azure. Adept at analyzing complex data. strong problem-solving abilities and a collaborative mindset..\n\n**Experience:**\n**Acme Corp** - Business Analyst (3 years)\n  - Led 3 major projects, improving efficiency by 31%.\n  - Mentored junior team members and fostered a collaborative environment.\n  - Developed and deployed X, Y, and Z features using Azure.\n**Global Innovations** - Associate Analyst (3 years)\n  - Contributed to 3 product releases.\n  - Performed data analysis using Frontend Development.\n\n**Education:** Bachelor's Degree in Engineering from a well-regarded university."
}