{
    "id": "5e19aceb-bf52-49a2-93a5-4e0007c7bcbb",
    "name": "Candidate 61 from GlobalSolutions Inc.",
    "job_title": "Product Manager",
    "industry": "Automotive",
    "level": "Lead",
    "skills": [
        "GCP",
        "SQL",
        "DevOps",
        "Blockchain"
    ],
    "raw_text": "Name: Candidate 61 from GlobalSolutions Inc.\nEmail: candidate.61.@example.com | Phone: (123) 555-0060\n\n**Summary:** A results-oriented and experienced Lead Product Manager with 15 years in the Automotive industry. Skilled in GCP, SQL, DevOps, Blockchain. Adept at leading cross-functional teams. strong problem-solving abilities and a collaborative mindset..\n\n**Experience:**\n**Acme Corp** - Product Manager (6 years)\n  - Led 3 major projects, improving efficiency by 18%.\n  - Mentored junior team members and fostered a collaborative environment.\n  - Developed and deployed X, Y, and Z features using DevOps.\n**Global Innovations** - Associate Manager (3 years)\n  - Contributed to 2 product releases.\n  - Performed data analysis using SQL.\n\n**Education:** Bachelor's Degree in Engineering from a well-regarded university."
}