{
    "id": "620dff93-1870-419e-9e79-5c7ff158b5e2",
    "name": "Candidate 16 from GlobalSolutions Inc.",
    "job_title": "Marketing Manager",
    "industry": "Manufacturing",
    "level": "Senior",
    "skills": [
        "HR Management",
        "Python",
        "SAP ERP",
        "Cybersecurity",
        "DevOps",
        "Frontend Development",
        "Marketing Strategy"
    ],
    "raw_text": "Name: Candidate 16 from GlobalSolutions Inc.\nEmail: candidate.16.@example.com | Phone: (123) 555-0015\n\n**Summary:** A results-oriented and experienced Senior Marketing Manager with 12 years in the Manufacturing industry. Skilled in HR Management, Python, SAP ERP, Cybersecurity, DevOps, Frontend Development, Marketing Strategy. Adept at leading cross-functional teams. strong problem-solving abilities and a collaborative mindset..\n\n**Experience:**\n**Acme Corp** - Marketing Manager (10 years)\n  - Led 1 major projects, improving efficiency by 40%.\n  - Mentored junior team members and fostered a collaborative environment.\n  - Developed and deployed X, Y, and Z features using Python.\n**Global Innovations** - Associate Manager (2 years)\n  - Contributed to 3 product releases.\n  - Performed data analysis using Cybersecurity.\n\n**Education:** Bachelor's Degree in Finance from a well-regarded university."
}