{
    "id": "68fef94f-8126-4733-93ce-a197eae72e6e",
    "name": "Candidate 43 from GlobalSolutions Inc.",
    "job_title": "DevOps Engineer",
    "industry": "Manufacturing",
    "level": "Mid",
    "skills": [
        "Frontend Development",
        "AWS",
        "Azure",
        "Cybersecurity",
        "Project Management"
    ],
    "raw_text": "Name: Candidate 43 from GlobalSolutions Inc.\nEmail: candidate.43.@example.com | Phone: (123) 555-0042\n\n**Summary:** A results-oriented and experienced Mid DevOps Engineer with 15 years in the Manufacturing industry. Skilled in Frontend Development, AWS, Azure, Cybersecurity, Project Management. Adept at building scalable systems. strong problem-solving abilities and a collaborative mindset..\n\n**Experience:**\n**Acme Corp** - DevOps Engineer (3 years)\n  - Led 1 major projects, improving efficiency by 28%.\n  - Mentored junior team members and fostered a collaborative environment.\n  - Developed and deployed X, Y, and Z features using Frontend Development.\n**Global Innovations** - Junior Engineer (1 years)\n  - Contributed to 2 product releases.\n  - Performed data analysis using Project Management.\n\n**Education:** Bachelor's Degree in Engineering from a well-regarded university."
}