{
    "id": "6cf456dd-9c93-4e5c-b9b7-97727e6d8c89",
    "name": "Candidate 59 from GlobalSolutions Inc.",
    "job_title": "Product Manager",
    "industry": "Biotech",
    "level": "Junior",
    "skills": [
        "Marketing Strategy",
        "Backend Development",
        "Java",
        "AWS",
        "DevOps",
        "Salesforce CRM",
        "SAP ERP"
    ],
    "raw_text": "Name: Candidate 59 from GlobalSolutions Inc.\nEmail: candidate.59.@example.com | Phone: (123) 555-0058\n\n**Summary:** A results-oriented and experienced Junior Product Manager with 15 years in the Biotech industry. Skilled in Marketing Strategy, Backend Development, Java, AWS, DevOps, Salesforce CRM, SAP ERP. Adept at leading cross-functional teams. strong problem-solving abilities and a collaborative mindset..\n\n**Experience:**\n**Acme Corp** - Product Manager (1 years)\n  - Led 3 major projects, improving efficiency by 14%.\n  - Mentored junior team members and fostered a collaborative environment.\n  - Developed and deployed X, Y, and Z features using DevOps.\n**Global Innovations** - Associate Manager (1 years)\n  - Contributed to 3 product releases.\n  - Performed data analysis using AWS.\n\n**Education:** Bachelor's Degree in Finance from a well-regarded university."
}