{
    "id": "74ea4789-b434-44e0-90d5-e5a5fe670421",
    "name": "Candidate 12 from GlobalSolutions Inc.",
    "job_title": "Product Manager",
    "industry": "Manufacturing",
    "level": "Director",
    "skills": [
        "Cybersecurity",
        "Azure",
        "GCP",
        "Sales Leadership",
        "DevOps",
        "AWS",
        "HR Management"
    ],
    "raw_text": "Name: Candidate 12 from GlobalSolutions Inc.\nEmail: candidate.12.@example.com | Phone: (123) 555-0011\n\n**Summary:** A results-oriented and experienced Director Product Manager with 4 years in the Manufacturing industry. Skilled in Cybersecurity, Azure, GCP, Sales Leadership, DevOps, AWS, HR Management. Adept at leading cross-functional teams. strong problem-solving abilities and a collaborative mindset..\n\n**Experience:**\n**Acme Corp** - Product Manager (2 years)\n  - Led 2 major projects, improving efficiency by 38%.\n  - Mentored junior team members and fostered a collaborative environment.\n  - Developed and deployed X, Y, and Z features using Cybersecurity.\n**Global Innovations** - Junior Manager (3 years)\n  - Contributed to 4 product releases.\n  - Performed data analysis using DevOps.\n\n**Education:** Bachelor's Degree in Computer Science from a well-regarded university."
}