{
    "id": "755cb22d-fa41-4112-8104-49813da1dfbe",
    "name": "Candidate 89 from GlobalSolutions Inc.",
    "job_title": "Technical Lead",
    "industry": "E-commerce",
    "level": "Lead",
    "skills": [
        "Python",
        "SAP ERP",
        "Cybersecurity",
        "Blockchain",
        "Azure"
    ],
    "raw_text": "Name: Candidate 89 from GlobalSolutions Inc.\nEmail: candidate.89.@example.com | Phone: (123) 555-0088\n\n**Summary:** A results-oriented and experienced Lead Technical Lead with 7 years in the E-commerce industry. Skilled in Python, SAP ERP, Cybersecurity, Blockchain, Azure. Adept at analyzing complex data. strong problem-solving abilities and a collaborative mindset..\n\n**Experience:**\n**Acme Corp** - Technical Lead (3 years)\n  - Led 2 major projects, improving efficiency by 23%.\n  - Mentored junior team members and fostered a collaborative environment.\n  - Developed and deployed X, Y, and Z features using SAP ERP.\n**Global Innovations** - Associate Lead (1 years)\n  - Contributed to 4 product releases.\n  - Performed data analysis using Cybersecurity.\n\n**Education:** Bachelor's Degree in Marketing from a well-regarded university."
}