{
    "id": "75dcb992-8f85-428f-a37d-1869da91b215",
    "name": "Candidate 91 from GlobalSolutions Inc.",
    "job_title": "Director of Engineering",
    "industry": "Tech",
    "level": "Lead",
    "skills": [
        "Machine Learning",
        "Financial Modeling",
        "Data Analysis",
        "Sales Leadership",
        "Salesforce CRM"
    ],
    "raw_text": "Name: Candidate 91 from GlobalSolutions Inc.\nEmail: candidate.91.@example.com | Phone: (123) 555-0090\n\n**Summary:** A results-oriented and experienced Lead Director of Engineering with 12 years in the Tech industry. Skilled in Machine Learning, Financial Modeling, Data Analysis, Sales Leadership, Salesforce CRM. Adept at building scalable systems. strong problem-solving abilities and a collaborative mindset..\n\n**Experience:**\n**Acme Corp** - Director of Engineering (1 years)\n  - Led 3 major projects, improving efficiency by 17%.\n  - Mentored junior team members and fostered a collaborative environment.\n  - Developed and deployed X, Y, and Z features using Data Analysis.\n**Global Innovations** - Associate Engineering (1 years)\n  - Contributed to 5 product releases.\n  - Performed data analysis using Data Analysis.\n\n**Education:** Bachelor's Degree in Business Administration from a well-regarded university."
}