{
    "id": "819bc28f-1836-4438-8cc2-75c5d5661d76",
    "name": "Candidate 96 from GlobalSolutions Inc.",
    "job_title": "Software Engineer",
    "industry": "Healthcare",
    "level": "Senior",
    "skills": [
        "Java",
        "GCP",
        "UI/UX Design",
        "Blockchain"
    ],
    "raw_text": "Name: Candidate 96 from GlobalSolutions Inc.\nEmail: candidate.96.@example.com | Phone: (123) 555-0095\n\n**Summary:** A results-oriented and experienced Senior Software Engineer with 3 years in the Healthcare industry. Skilled in Java, GCP, UI/UX Design, Blockchain. Adept at building scalable systems. strong problem-solving abilities and a collaborative mindset..\n\n**Experience:**\n**Acme Corp** - Software Engineer (1 years)\n  - Led 3 major projects, improving efficiency by 32%.\n  - Mentored junior team members and fostered a collaborative environment.\n  - Developed and deployed X, Y, and Z features using GCP.\n**Global Innovations** - Junior Engineer (1 years)\n  - Contributed to 2 product releases.\n  - Performed data analysis using UI/UX Design.\n\n**Education:** Bachelor's Degree in Engineering from a well-regarded university."
}