{
    "id": "8343e25a-e680-4d62-bf58-db9c2cafd9ff",
    "name": "Candidate 50 from GlobalSolutions Inc.",
    "job_title": "Software Engineer",
    "industry": "SaaS",
    "level": "Director",
    "skills": [
        "Sales Leadership",
        "Project Management",
        "SAP ERP",
        "GCP",
        "Product Management",
        "Azure",
        "Cybersecurity"
    ],
    "raw_text": "Name: Candidate 50 from GlobalSolutions Inc.\nEmail: candidate.50.@example.com | Phone: (123) 555-0049\n\n**Summary:** A results-oriented and experienced Director Software Engineer with 6 years in the SaaS industry. Skilled in Sales Leadership, Project Management, SAP ERP, GCP, Product Management, Azure, Cybersecurity. Adept at building scalable systems. strong problem-solving abilities and a collaborative mindset..\n\n**Experience:**\n**Acme Corp** - Software Engineer (2 years)\n  - Led 1 major projects, improving efficiency by 40%.\n  - Mentored junior team members and fostered a collaborative environment.\n  - Developed and deployed X, Y, and Z features using SAP ERP.\n**Global Innovations** - Associate Engineer (2 years)\n  - Contributed to 5 product releases.\n  - Performed data analysis using Project Management.\n\n**Education:** Bachelor's Degree in Marketing from a well-regarded university."
}