{
    "id": "857c2857-1280-4564-b467-57419c58c0df",
    "name": "Candidate 33 from GlobalSolutions Inc.",
    "job_title": "UX Designer",
    "industry": "Finance",
    "level": "Lead",
    "skills": [
        "Blockchain",
        "Python",
        "Azure",
        "DevOps",
        "Data Analysis",
        "AWS",
        "Product Management"
    ],
    "raw_text": "Name: Candidate 33 from GlobalSolutions Inc.\nEmail: candidate.33.@example.com | Phone: (123) 555-0032\n\n**Summary:** A results-oriented and experienced Lead UX Designer with 11 years in the Finance industry. Skilled in Blockchain, Python, Azure, DevOps, Data Analysis, AWS, Product Management. Adept at analyzing complex data. strong problem-solving abilities and a collaborative mindset..\n\n**Experience:**\n**Acme Corp** - UX Designer (10 years)\n  - Led 3 major projects, improving efficiency by 11%.\n  - Mentored junior team members and fostered a collaborative environment.\n  - Developed and deployed X, Y, and Z features using AWS.\n**Global Innovations** - Associate Designer (2 years)\n  - Contributed to 2 product releases.\n  - Performed data analysis using DevOps.\n\n**Education:** Bachelor's Degree in Computer Science from a well-regarded university."
}