{
    "id": "858dd178-a807-4428-b557-9544bc0abb57",
    "name": "Candidate 35 from GlobalSolutions Inc.",
    "job_title": "Marketing Manager",
    "industry": "Consulting",
    "level": "Junior",
    "skills": [
        "AWS",
        "Cybersecurity",
        "UI/UX Design",
        "Frontend Development"
    ],
    "raw_text": "Name: Candidate 35 from GlobalSolutions Inc.\nEmail: candidate.35.@example.com | Phone: (123) 555-0034\n\n**Summary:** A results-oriented and experienced Junior Marketing Manager with 13 years in the Consulting industry. Skilled in AWS, Cybersecurity, UI/UX Design, Frontend Development. Adept at leading cross-functional teams. strong problem-solving abilities and a collaborative mindset..\n\n**Experience:**\n**Acme Corp** - Marketing Manager (9 years)\n  - Led 2 major projects, improving efficiency by 21%.\n  - Mentored junior team members and fostered a collaborative environment.\n  - Developed and deployed X, Y, and Z features using AWS.\n**Global Innovations** - Associate Manager (3 years)\n  - Contributed to 4 product releases.\n  - Performed data analysis using Cybersecurity.\n\n**Education:** Bachelor's Degree in Finance from a well-regarded university."
}