{
    "id": "88a367c9-a31e-43c5-b460-6b27cccebd14",
    "name": "Candidate 13 from GlobalSolutions Inc.",
    "job_title": "Technical Lead",
    "industry": "E-commerce",
    "level": "Senior",
    "skills": [
        "Python",
        "Project Management",
        "Salesforce CRM",
        "Sales Leadership",
        "Java",
        "UI/UX Design",
        "Product Management",
        "Financial Modeling"
    ],
    "raw_text": "Name: Candidate 13 from GlobalSolutions Inc.\nEmail: candidate.13.@example.com | Phone: (123) 555-0012\n\n**Summary:** A results-oriented and experienced Senior Technical Lead with 9 years in the E-commerce industry. Skilled in Python, Project Management, Salesforce CRM, Sales Leadership, Java, UI/UX Design, Product Management, Financial Modeling. Adept at analyzing complex data. strong problem-solving abilities and a collaborative mindset..\n\n**Experience:**\n**Acme Corp** - Technical Lead (5 years)\n  - Led 2 major projects, improving efficiency by 38%.\n  - Mentored junior team members and fostered a collaborative environment.\n  - Developed and deployed X, Y, and Z features using UI/UX Design.\n**Global Innovations** - Junior Lead (1 years)\n  - Contributed to 2 product releases.\n  - Performed data analysis using Product Management.\n\n**Education:** Bachelor's Degree in Computer Science from a well-regarded university."
}