{
    "id": "89cb314e-0446-471b-8cd6-b78868b35784",
    "name": "Candidate 62 from GlobalSolutions Inc.",
    "job_title": "Director of Engineering",
    "industry": "Retail",
    "level": "Senior",
    "skills": [
        "Sales Leadership",
        "Backend Development",
        "Marketing Strategy",
        "Machine Learning",
        "HR Management",
        "GCP",
        "Python"
    ],
    "raw_text": "Name: Candidate 62 from GlobalSolutions Inc.\nEmail: candidate.62.@example.com | Phone: (123) 555-0061\n\n**Summary:** A results-oriented and experienced Senior Director of Engineering with 9 years in the Retail industry. Skilled in Sales Leadership, Backend Development, Marketing Strategy, Machine Learning, HR Management, GCP, Python. Adept at building scalable systems. strong problem-solving abilities and a collaborative mindset..\n\n**Experience:**\n**Acme Corp** - Director of Engineering (8 years)\n  - Led 3 major projects, improving efficiency by 20%.\n  - Mentored junior team members and fostered a collaborative environment.\n  - Developed and deployed X, Y, and Z features using Python.\n**Global Innovations** - Junior Engineering (1 years)\n  - Contributed to 2 product releases.\n  - Performed data analysis using GCP.\n\n**Education:** Bachelor's Degree in Computer Science from a well-regarded university."
}