{
    "id": "89f406e2-8994-4a18-9fda-5b97666a13f3",
    "name": "Candidate 6 from GlobalSolutions Inc.",
    "job_title": "VP of Sales",
    "industry": "Consulting",
    "level": "Lead",
    "skills": [
        "Frontend Development",
        "Machine Learning",
        "DevOps",
        "GCP",
        "Java"
    ],
    "raw_text": "Name: Candidate 6 from GlobalSolutions Inc.\nEmail: candidate.6.@example.com | Phone: (123) 555-0005\n\n**Summary:** A results-oriented and experienced Lead VP of Sales with 11 years in the Consulting industry. Skilled in Frontend Development, Machine Learning, DevOps, GCP, Java. Adept at driving revenue growth. strong problem-solving abilities and a collaborative mindset..\n\n**Experience:**\n**Acme Corp** - VP of Sales (7 years)\n  - Led 3 major projects, improving efficiency by 24%.\n  - Mentored junior team members and fostered a collaborative environment.\n  - Developed and deployed X, Y, and Z features using DevOps.\n**Global Innovations** - Associate Sales (1 years)\n  - Contributed to 4 product releases.\n  - Performed data analysis using Frontend Development.\n\n**Education:** Bachelor's Degree in Business Administration from a well-regarded university."
}