{
    "id": "8fae64b0-04d3-45c8-9c4a-fa8d34ad4cb9",
    "name": "Candidate 56 from GlobalSolutions Inc.",
    "job_title": "UX Designer",
    "industry": "Tech",
    "level": "Lead",
    "skills": [
        "Backend Development",
        "Marketing Strategy",
        "Machine Learning"
    ],
    "raw_text": "Name: Candidate 56 from GlobalSolutions Inc.\nEmail: candidate.56.@example.com | Phone: (123) 555-0055\n\n**Summary:** A results-oriented and experienced Lead UX Designer with 3 years in the Tech industry. Skilled in Backend Development, Marketing Strategy, Machine Learning. Adept at analyzing complex data. strong problem-solving abilities and a collaborative mindset..\n\n**Experience:**\n**Acme Corp** - UX Designer (2 years)\n  - Led 2 major projects, improving efficiency by 22%.\n  - Mentored junior team members and fostered a collaborative environment.\n  - Developed and deployed X, Y, and Z features using Marketing Strategy.\n**Global Innovations** - Junior Designer (1 years)\n  - Contributed to 2 product releases.\n  - Performed data analysis using Marketing Strategy.\n\n**Education:** Bachelor's Degree in Business Administration from a well-regarded university."
}