{
    "id": "8fd213af-6eac-4bd5-943a-558bc523df89",
    "name": "Candidate 8 from GlobalSolutions Inc.",
    "job_title": "DevOps Engineer",
    "industry": "Finance",
    "level": "Junior",
    "skills": [
        "SQL",
        "Financial Modeling",
        "Data Analysis",
        "Salesforce CRM",
        "SAP ERP",
        "Cybersecurity",
        "DevOps",
        "GCP"
    ],
    "raw_text": "Name: Candidate 8 from GlobalSolutions Inc.\nEmail: candidate.8.@example.com | Phone: (123) 555-0007\n\n**Summary:** A results-oriented and experienced Junior DevOps Engineer with 5 years in the Finance industry. Skilled in SQL, Financial Modeling, Data Analysis, Salesforce CRM, SAP ERP, Cybersecurity, DevOps, GCP. Adept at building scalable systems. strong problem-solving abilities and a collaborative mindset..\n\n**Experience:**\n**Acme Corp** - DevOps Engineer (2 years)\n  - Led 2 major projects, improving efficiency by 12%.\n  - Mentored junior team members and fostered a collaborative environment.\n  - Developed and deployed X, Y, and Z features using SQL.\n**Global Innovations** - Junior Engineer (1 years)\n  - Contributed to 5 product releases.\n  - Performed data analysis using SAP ERP.\n\n**Education:** Bachelor's Degree in Engineering from a well-regarded university."
}