{
    "id": "8fe7af6d-14ad-4743-93be-5173e77389f9",
    "name": "Candidate 76 from GlobalSolutions Inc.",
    "job_title": "Technical Lead",
    "industry": "Retail",
    "level": "Director",
    "skills": [
        "UI/UX Design",
        "Marketing Strategy",
        "Backend Development",
        "SQL",
        "Java",
        "Product Management",
        "Machine Learning"
    ],
    "raw_text": "Name: Candidate 76 from GlobalSolutions Inc.\nEmail: candidate.76.@example.com | Phone: (123) 555-0075\n\n**Summary:** A results-oriented and experienced Director Technical Lead with 15 years in the Retail industry. Skilled in UI/UX Design, Marketing Strategy, Backend Development, SQL, Java, Product Management, Machine Learning. Adept at analyzing complex data. strong problem-solving abilities and a collaborative mindset..\n\n**Experience:**\n**Acme Corp** - Technical Lead (6 years)\n  - Led 1 major projects, improving efficiency by 11%.\n  - Mentored junior team members and fostered a collaborative environment.\n  - Developed and deployed X, Y, and Z features using Marketing Strategy.\n**Global Innovations** - Junior Lead (2 years)\n  - Contributed to 2 product releases.\n  - Performed data analysis using Backend Development.\n\n**Education:** Bachelor's Degree in Marketing from a well-regarded university."
}