{
    "id": "90b1661d-dacb-4087-aa78-8326fb06f83b",
    "name": "Candidate 51 from GlobalSolutions Inc.",
    "job_title": "DevOps Engineer",
    "industry": "Healthcare",
    "level": "Junior",
    "skills": [
        "Project Management",
        "Product Management",
        "HR Management",
        "SAP ERP",
        "Machine Learning"
    ],
    "raw_text": "Name: Candidate 51 from GlobalSolutions Inc.\nEmail: candidate.51.@example.com | Phone: (123) 555-0050\n\n**Summary:** A results-oriented and experienced Junior DevOps Engineer with 13 years in the Healthcare industry. Skilled in Project Management, Product Management, HR Management, SAP ERP, Machine Learning. Adept at building scalable systems. strong problem-solving abilities and a collaborative mindset..\n\n**Experience:**\n**Acme Corp** - DevOps Engineer (3 years)\n  - Led 1 major projects, improving efficiency by 32%.\n  - Mentored junior team members and fostered a collaborative environment.\n  - Developed and deployed X, Y, and Z features using Machine Learning.\n**Global Innovations** - Associate Engineer (2 years)\n  - Contributed to 3 product releases.\n  - Performed data analysis using Project Management.\n\n**Education:** Bachelor's Degree in Business Administration from a well-regarded university."
}