{
    "id": "92c34c9a-d936-4f9e-bc07-b366549725bb",
    "name": "Candidate 28 from GlobalSolutions Inc.",
    "job_title": "Director of Engineering",
    "industry": "Biotech",
    "level": "Mid",
    "skills": [
        "SAP ERP",
        "Java",
        "Project Management"
    ],
    "raw_text": "Name: Candidate 28 from GlobalSolutions Inc.\nEmail: candidate.28.@example.com | Phone: (123) 555-0027\n\n**Summary:** A results-oriented and experienced Mid Director of Engineering with 10 years in the Biotech industry. Skilled in SAP ERP, Java, Project Management. Adept at building scalable systems. strong problem-solving abilities and a collaborative mindset..\n\n**Experience:**\n**Acme Corp** - Director of Engineering (5 years)\n  - Led 1 major projects, improving efficiency by 10%.\n  - Mentored junior team members and fostered a collaborative environment.\n  - Developed and deployed X, Y, and Z features using Project Management.\n**Global Innovations** - Junior Engineering (2 years)\n  - Contributed to 3 product releases.\n  - Performed data analysis using Java.\n\n**Education:** Bachelor's Degree in Business Administration from a well-regarded university."
}