{
    "id": "934484f9-4642-4fb2-8611-a9a71a7223d0",
    "name": "Candidate 86 from GlobalSolutions Inc.",
    "job_title": "Business Analyst",
    "industry": "Healthcare",
    "level": "Senior",
    "skills": [
        "Product Management",
        "Marketing Strategy",
        "Azure",
        "Blockchain",
        "Backend Development"
    ],
    "raw_text": "Name: Candidate 86 from GlobalSolutions Inc.\nEmail: candidate.86.@example.com | Phone: (123) 555-0085\n\n**Summary:** A results-oriented and experienced Senior Business Analyst with 5 years in the Healthcare industry. Skilled in Product Management, Marketing Strategy, Azure, Blockchain, Backend Development. Adept at analyzing complex data. strong problem-solving abilities and a collaborative mindset..\n\n**Experience:**\n**Acme Corp** - Business Analyst (1 years)\n  - Led 2 major projects, improving efficiency by 38%.\n  - Mentored junior team members and fostered a collaborative environment.\n  - Developed and deployed X, Y, and Z features using Backend Development.\n**Global Innovations** - Associate Analyst (1 years)\n  - Contributed to 2 product releases.\n  - Performed data analysis using Blockchain.\n\n**Education:** Bachelor's Degree in Engineering from a well-regarded university."
}