{
    "id": "9525b254-2455-44af-a1e2-7622d19b2473",
    "name": "Candidate 52 from GlobalSolutions Inc.",
    "job_title": "HR Business Partner",
    "industry": "Manufacturing",
    "level": "Director",
    "skills": [
        "UI/UX Design",
        "Product Management",
        "SQL",
        "Data Analysis",
        "GCP",
        "Python"
    ],
    "raw_text": "Name: Candidate 52 from GlobalSolutions Inc.\nEmail: candidate.52.@example.com | Phone: (123) 555-0051\n\n**Summary:** A results-oriented and experienced Director HR Business Partner with 7 years in the Manufacturing industry. Skilled in UI/UX Design, Product Management, SQL, Data Analysis, GCP, Python. Adept at analyzing complex data. strong problem-solving abilities and a collaborative mindset..\n\n**Experience:**\n**Acme Corp** - HR Business Partner (3 years)\n  - Led 2 major projects, improving efficiency by 18%.\n  - Mentored junior team members and fostered a collaborative environment.\n  - Developed and deployed X, Y, and Z features using UI/UX Design.\n**Global Innovations** - Junior Partner (1 years)\n  - Contributed to 4 product releases.\n  - Performed data analysis using GCP.\n\n**Education:** Bachelor's Degree in Computer Science from a well-regarded university."
}