{
    "id": "975dc728-5b9f-4533-8c10-ae2f9b8f983e",
    "name": "Candidate 4 from GlobalSolutions Inc.",
    "job_title": "Marketing Manager",
    "industry": "Manufacturing",
    "level": "Junior",
    "skills": [
        "Cybersecurity",
        "Frontend Development",
        "Machine Learning"
    ],
    "raw_text": "Name: Candidate 4 from GlobalSolutions Inc.\nEmail: candidate.4.@example.com | Phone: (123) 555-0003\n\n**Summary:** A results-oriented and experienced Junior Marketing Manager with 5 years in the Manufacturing industry. Skilled in Cybersecurity, Frontend Development, Machine Learning. Adept at leading cross-functional teams. strong problem-solving abilities and a collaborative mindset..\n\n**Experience:**\n**Acme Corp** - Marketing Manager (1 years)\n  - Led 2 major projects, improving efficiency by 40%.\n  - Mentored junior team members and fostered a collaborative environment.\n  - Developed and deployed X, Y, and Z features using Frontend Development.\n**Global Innovations** - Associate Manager (2 years)\n  - Contributed to 2 product releases.\n  - Performed data analysis using Cybersecurity.\n\n**Education:** Bachelor's Degree in Business Administration from a well-regarded university."
}