{
    "id": "99d10a54-6ee0-48c2-b651-5506f56c704b",
    "name": "Candidate 23 from GlobalSolutions Inc.",
    "job_title": "HR Business Partner",
    "industry": "Automotive",
    "level": "Junior",
    "skills": [
        "GCP",
        "Data Analysis",
        "UI/UX Design"
    ],
    "raw_text": "Name: Candidate 23 from GlobalSolutions Inc.\nEmail: candidate.23.@example.com | Phone: (123) 555-0022\n\n**Summary:** A results-oriented and experienced Junior HR Business Partner with 11 years in the Automotive industry. Skilled in GCP, Data Analysis, UI/UX Design. Adept at analyzing complex data. strong problem-solving abilities and a collaborative mindset..\n\n**Experience:**\n**Acme Corp** - HR Business Partner (5 years)\n  - Led 2 major projects, improving efficiency by 19%.\n  - Mentored junior team members and fostered a collaborative environment.\n  - Developed and deployed X, Y, and Z features using UI/UX Design.\n**Global Innovations** - Junior Partner (2 years)\n  - Contributed to 3 product releases.\n  - Performed data analysis using GCP.\n\n**Education:** Bachelor's Degree in Business Administration from a well-regarded university."
}