{
    "id": "a02fdab9-1d3c-479c-926d-38eb76695288",
    "name": "Candidate 77 from GlobalSolutions Inc.",
    "job_title": "Software Engineer",
    "industry": "Retail",
    "level": "Junior",
    "skills": [
        "Financial Modeling",
        "Azure",
        "Backend Development"
    ],
    "raw_text": "Name: Candidate 77 from GlobalSolutions Inc.\nEmail: candidate.77.@example.com | Phone: (123) 555-0076\n\n**Summary:** A results-oriented and experienced Junior Software Engineer with 4 years in the Retail industry. Skilled in Financial Modeling, Azure, Backend Development. Adept at building scalable systems. strong problem-solving abilities and a collaborative mindset..\n\n**Experience:**\n**Acme Corp** - Software Engineer (3 years)\n  - Led 2 major projects, improving efficiency by 22%.\n  - Mentored junior team members and fostered a collaborative environment.\n  - Developed and deployed X, Y, and Z features using Financial Modeling.\n**Global Innovations** - Associate Engineer (1 years)\n  - Contributed to 5 product releases.\n  - Performed data analysis using Backend Development.\n\n**Education:** Bachelor's Degree in Business Administration from a well-regarded university."
}