{
    "id": "a1949855-02e0-4f0d-bfb8-6eb1499c55e3",
    "name": "Candidate 99 from GlobalSolutions Inc.",
    "job_title": "Technical Lead",
    "industry": "E-commerce",
    "level": "Senior",
    "skills": [
        "Salesforce CRM",
        "Sales Leadership",
        "GCP",
        "Machine Learning"
    ],
    "raw_text": "Name: Candidate 99 from GlobalSolutions Inc.\nEmail: candidate.99.@example.com | Phone: (123) 555-0098\n\n**Summary:** A results-oriented and experienced Senior Technical Lead with 4 years in the E-commerce industry. Skilled in Salesforce CRM, Sales Leadership, GCP, Machine Learning. Adept at analyzing complex data. strong problem-solving abilities and a collaborative mindset..\n\n**Experience:**\n**Acme Corp** - Technical Lead (3 years)\n  - Led 3 major projects, improving efficiency by 27%.\n  - Mentored junior team members and fostered a collaborative environment.\n  - Developed and deployed X, Y, and Z features using Machine Learning.\n**Global Innovations** - Junior Lead (1 years)\n  - Contributed to 4 product releases.\n  - Performed data analysis using Salesforce CRM.\n\n**Education:** Bachelor's Degree in Marketing from a well-regarded university."
}