{
    "id": "a26c16ff-5925-4dfe-bcb1-d1546e117ad1",
    "name": "Candidate 64 from GlobalSolutions Inc.",
    "job_title": "Technical Lead",
    "industry": "Healthcare",
    "level": "Director",
    "skills": [
        "Data Analysis",
        "GCP",
        "Azure",
        "Salesforce CRM",
        "AWS",
        "Python"
    ],
    "raw_text": "Name: Candidate 64 from GlobalSolutions Inc.\nEmail: candidate.64.@example.com | Phone: (123) 555-0063\n\n**Summary:** A results-oriented and experienced Director Technical Lead with 7 years in the Healthcare industry. Skilled in Data Analysis, GCP, Azure, Salesforce CRM, AWS, Python. Adept at analyzing complex data. strong problem-solving abilities and a collaborative mindset..\n\n**Experience:**\n**Acme Corp** - Technical Lead (5 years)\n  - Led 1 major projects, improving efficiency by 20%.\n  - Mentored junior team members and fostered a collaborative environment.\n  - Developed and deployed X, Y, and Z features using Azure.\n**Global Innovations** - Associate Lead (3 years)\n  - Contributed to 4 product releases.\n  - Performed data analysis using Azure.\n\n**Education:** Bachelor's Degree in Computer Science from a well-regarded university."
}