{
    "id": "a3a71efe-b0ac-4874-9cfe-4e80cc0512ac",
    "name": "Candidate 21 from GlobalSolutions Inc.",
    "job_title": "Director of Engineering",
    "industry": "Retail",
    "level": "Manager",
    "skills": [
        "Data Analysis",
        "Financial Modeling",
        "DevOps"
    ],
    "raw_text": "Name: Candidate 21 from GlobalSolutions Inc.\nEmail: candidate.21.@example.com | Phone: (123) 555-0020\n\n**Summary:** A results-oriented and experienced Manager Director of Engineering with 9 years in the Retail industry. Skilled in Data Analysis, Financial Modeling, DevOps. Adept at building scalable systems. strong problem-solving abilities and a collaborative mindset..\n\n**Experience:**\n**Acme Corp** - Director of Engineering (3 years)\n  - Led 1 major projects, improving efficiency by 15%.\n  - Mentored junior team members and fostered a collaborative environment.\n  - Developed and deployed X, Y, and Z features using DevOps.\n**Global Innovations** - Associate Engineering (2 years)\n  - Contributed to 5 product releases.\n  - Performed data analysis using Financial Modeling.\n\n**Education:** Bachelor's Degree in Engineering from a well-regarded university."
}