{
    "id": "a3b543f4-3074-42ad-91d1-51b1da375238",
    "name": "Candidate 68 from GlobalSolutions Inc.",
    "job_title": "Software Engineer",
    "industry": "Automotive",
    "level": "Lead",
    "skills": [
        "Salesforce CRM",
        "Project Management",
        "Cybersecurity",
        "DevOps"
    ],
    "raw_text": "Name: Candidate 68 from GlobalSolutions Inc.\nEmail: candidate.68.@example.com | Phone: (123) 555-0067\n\n**Summary:** A results-oriented and experienced Lead Software Engineer with 15 years in the Automotive industry. Skilled in Salesforce CRM, Project Management, Cybersecurity, DevOps. Adept at building scalable systems. strong problem-solving abilities and a collaborative mindset..\n\n**Experience:**\n**Acme Corp** - Software Engineer (5 years)\n  - Led 1 major projects, improving efficiency by 27%.\n  - Mentored junior team members and fostered a collaborative environment.\n  - Developed and deployed X, Y, and Z features using Cybersecurity.\n**Global Innovations** - Associate Engineer (2 years)\n  - Contributed to 2 product releases.\n  - Performed data analysis using Cybersecurity.\n\n**Education:** Bachelor's Degree in Finance from a well-regarded university."
}