{
    "id": "a9022d5d-c83b-4d3b-9630-440fd87e7beb",
    "name": "Candidate 1 from GlobalSolutions Inc.",
    "job_title": "HR Business Partner",
    "industry": "Manufacturing",
    "level": "Mid",
    "skills": [
        "Backend Development",
        "Sales Leadership",
        "GCP",
        "Product Management"
    ],
    "raw_text": "Name: Candidate 1 from GlobalSolutions Inc.\nEmail: candidate.1.@example.com | Phone: (123) 555-0000\n\n**Summary:** A results-oriented and experienced Mid HR Business Partner with 13 years in the Manufacturing industry. Skilled in Backend Development, Sales Leadership, GCP, Product Management. Adept at analyzing complex data. strong problem-solving abilities and a collaborative mindset..\n\n**Experience:**\n**Acme Corp** - HR Business Partner (2 years)\n  - Led 2 major projects, improving efficiency by 11%.\n  - Mentored junior team members and fostered a collaborative environment.\n  - Developed and deployed X, Y, and Z features using Product Management.\n**Global Innovations** - Associate Partner (3 years)\n  - Contributed to 4 product releases.\n  - Performed data analysis using GCP.\n\n**Education:** Bachelor's Degree in Finance from a well-regarded university."
}