{
    "id": "a99e4379-bd13-4476-8680-9aa4adb4960c",
    "name": "Candidate 69 from GlobalSolutions Inc.",
    "job_title": "UX Designer",
    "industry": "Healthcare",
    "level": "Manager",
    "skills": [
        "Sales Leadership",
        "Marketing Strategy",
        "Financial Modeling",
        "DevOps",
        "Python",
        "GCP",
        "Salesforce CRM",
        "Product Management"
    ],
    "raw_text": "Name: Candidate 69 from GlobalSolutions Inc.\nEmail: candidate.69.@example.com | Phone: (123) 555-0068\n\n**Summary:** A results-oriented and experienced Manager UX Designer with 8 years in the Healthcare industry. Skilled in Sales Leadership, Marketing Strategy, Financial Modeling, DevOps, Python, GCP, Salesforce CRM, Product Management. Adept at analyzing complex data. strong problem-solving abilities and a collaborative mindset..\n\n**Experience:**\n**Acme Corp** - UX Designer (7 years)\n  - Led 3 major projects, improving efficiency by 27%.\n  - Mentored junior team members and fostered a collaborative environment.\n  - Developed and deployed X, Y, and Z features using Product Management.\n**Global Innovations** - Junior Designer (2 years)\n  - Contributed to 5 product releases.\n  - Performed data analysis using Python.\n\n**Education:** Bachelor's Degree in Marketing from a well-regarded university."
}