{
    "id": "ab4190e2-856c-4b5d-8347-7860ca6e7d6b",
    "name": "Candidate 22 from GlobalSolutions Inc.",
    "job_title": "VP of Sales",
    "industry": "Retail",
    "level": "Mid",
    "skills": [
        "Sales Leadership",
        "GCP",
        "Project Management",
        "DevOps",
        "Frontend Development"
    ],
    "raw_text": "Name: Candidate 22 from GlobalSolutions Inc.\nEmail: candidate.22.@example.com | Phone: (123) 555-0021\n\n**Summary:** A results-oriented and experienced Mid VP of Sales with 12 years in the Retail industry. Skilled in Sales Leadership, GCP, Project Management, DevOps, Frontend Development. Adept at driving revenue growth. strong problem-solving abilities and a collaborative mindset..\n\n**Experience:**\n**Acme Corp** - VP of Sales (11 years)\n  - Led 3 major projects, improving efficiency by 27%.\n  - Mentored junior team members and fostered a collaborative environment.\n  - Developed and deployed X, Y, and Z features using DevOps.\n**Global Innovations** - Associate Sales (3 years)\n  - Contributed to 2 product releases.\n  - Performed data analysis using Frontend Development.\n\n**Education:** Bachelor's Degree in Computer Science from a well-regarded university."
}