{
    "id": "c0466fac-17f5-4f54-9198-904e6186d2f3",
    "name": "Candidate 41 from GlobalSolutions Inc.",
    "job_title": "Marketing Manager",
    "industry": "Consulting",
    "level": "Mid",
    "skills": [
        "Backend Development",
        "Java",
        "AWS",
        "HR Management",
        "GCP",
        "Cybersecurity"
    ],
    "raw_text": "Name: Candidate 41 from GlobalSolutions Inc.\nEmail: candidate.41.@example.com | Phone: (123) 555-0040\n\n**Summary:** A results-oriented and experienced Mid Marketing Manager with 2 years in the Consulting industry. Skilled in Backend Development, Java, AWS, HR Management, GCP, Cybersecurity. Adept at leading cross-functional teams. strong problem-solving abilities and a collaborative mindset..\n\n**Experience:**\n**Acme Corp** - Marketing Manager (1 years)\n  - Led 2 major projects, improving efficiency by 14%.\n  - Mentored junior team members and fostered a collaborative environment.\n  - Developed and deployed X, Y, and Z features using Backend Development.\n**Global Innovations** - Associate Manager (2 years)\n  - Contributed to 3 product releases.\n  - Performed data analysis using AWS.\n\n**Education:** Bachelor's Degree in Engineering from a well-regarded university."
}