{
    "id": "c1e29ab0-52c2-410f-b519-5b5040c615dc",
    "name": "Candidate 37 from GlobalSolutions Inc.",
    "job_title": "Marketing Manager",
    "industry": "SaaS",
    "level": "Director",
    "skills": [
        "SQL",
        "Blockchain",
        "Python"
    ],
    "raw_text": "Name: Candidate 37 from GlobalSolutions Inc.\nEmail: candidate.37.@example.com | Phone: (123) 555-0036\n\n**Summary:** A results-oriented and experienced Director Marketing Manager with 9 years in the SaaS industry. Skilled in SQL, Blockchain, Python. Adept at leading cross-functional teams. strong problem-solving abilities and a collaborative mindset..\n\n**Experience:**\n**Acme Corp** - Marketing Manager (8 years)\n  - Led 2 major projects, improving efficiency by 14%.\n  - Mentored junior team members and fostered a collaborative environment.\n  - Developed and deployed X, Y, and Z features using SQL.\n**Global Innovations** - Junior Manager (3 years)\n  - Contributed to 3 product releases.\n  - Performed data analysis using Blockchain.\n\n**Education:** Bachelor's Degree in Marketing from a well-regarded university."
}