{
    "id": "c644b43c-3c14-4ca8-8e5d-50097153cd7e",
    "name": "Candidate 100 from GlobalSolutions Inc.",
    "job_title": "Marketing Manager",
    "industry": "Tech",
    "level": "Junior",
    "skills": [
        "Sales Leadership",
        "Financial Modeling",
        "Python"
    ],
    "raw_text": "Name: Candidate 100 from GlobalSolutions Inc.\nEmail: candidate.100.@example.com | Phone: (123) 555-0099\n\n**Summary:** A results-oriented and experienced Junior Marketing Manager with 13 years in the Tech industry. Skilled in Sales Leadership, Financial Modeling, Python. Adept at leading cross-functional teams. strong problem-solving abilities and a collaborative mindset..\n\n**Experience:**\n**Acme Corp** - Marketing Manager (12 years)\n  - Led 2 major projects, improving efficiency by 13%.\n  - Mentored junior team members and fostered a collaborative environment.\n  - Developed and deployed X, Y, and Z features using Python.\n**Global Innovations** - Associate Manager (1 years)\n  - Contributed to 2 product releases.\n  - Performed data analysis using Financial Modeling.\n\n**Education:** Bachelor's Degree in Finance from a well-regarded university."
}