{
    "id": "c8388b8e-7049-44b7-9308-ce9236a77160",
    "name": "Candidate 34 from GlobalSolutions Inc.",
    "job_title": "Business Analyst",
    "industry": "Retail",
    "level": "Junior",
    "skills": [
        "Python",
        "Backend Development",
        "HR Management"
    ],
    "raw_text": "Name: Candidate 34 from GlobalSolutions Inc.\nEmail: candidate.34.@example.com | Phone: (123) 555-0033\n\n**Summary:** A results-oriented and experienced Junior Business Analyst with 14 years in the Retail industry. Skilled in Python, Backend Development, HR Management. Adept at analyzing complex data. strong problem-solving abilities and a collaborative mindset..\n\n**Experience:**\n**Acme Corp** - Business Analyst (3 years)\n  - Led 1 major projects, improving efficiency by 30%.\n  - Mentored junior team members and fostered a collaborative environment.\n  - Developed and deployed X, Y, and Z features using HR Management.\n**Global Innovations** - Junior Analyst (1 years)\n  - Contributed to 3 product releases.\n  - Performed data analysis using Python.\n\n**Education:** Bachelor's Degree in Finance from a well-regarded university."
}