{
    "id": "ccd51484-04bd-4138-a4e3-51d60e9e1c9f",
    "name": "Candidate 18 from GlobalSolutions Inc.",
    "job_title": "UX Designer",
    "industry": "SaaS",
    "level": "Director",
    "skills": [
        "Azure",
        "SQL",
        "Sales Leadership",
        "Project Management",
        "Frontend Development",
        "Marketing Strategy"
    ],
    "raw_text": "Name: Candidate 18 from GlobalSolutions Inc.\nEmail: candidate.18.@example.com | Phone: (123) 555-0017\n\n**Summary:** A results-oriented and experienced Director UX Designer with 7 years in the SaaS industry. Skilled in Azure, SQL, Sales Leadership, Project Management, Frontend Development, Marketing Strategy. Adept at analyzing complex data. strong problem-solving abilities and a collaborative mindset..\n\n**Experience:**\n**Acme Corp** - UX Designer (5 years)\n  - Led 2 major projects, improving efficiency by 11%.\n  - Mentored junior team members and fostered a collaborative environment.\n  - Developed and deployed X, Y, and Z features using Marketing Strategy.\n**Global Innovations** - Associate Designer (3 years)\n  - Contributed to 3 product releases.\n  - Performed data analysis using SQL.\n\n**Education:** Bachelor's Degree in Finance from a well-regarded university."
}