{
    "id": "ce94cd2a-de81-487b-a196-0bf270511f34",
    "name": "Candidate 49 from GlobalSolutions Inc.",
    "job_title": "Financial Analyst",
    "industry": "E-commerce",
    "level": "Director",
    "skills": [
        "Machine Learning",
        "Azure",
        "SAP ERP",
        "DevOps",
        "Blockchain",
        "Salesforce CRM",
        "Marketing Strategy",
        "Cybersecurity"
    ],
    "raw_text": "Name: Candidate 49 from GlobalSolutions Inc.\nEmail: candidate.49.@example.com | Phone: (123) 555-0048\n\n**Summary:** A results-oriented and experienced Director Financial Analyst with 9 years in the E-commerce industry. Skilled in Machine Learning, Azure, SAP ERP, DevOps, Blockchain, Salesforce CRM, Marketing Strategy, Cybersecurity. Adept at analyzing complex data. strong problem-solving abilities and a collaborative mindset..\n\n**Experience:**\n**Acme Corp** - Financial Analyst (5 years)\n  - Led 1 major projects, improving efficiency by 25%.\n  - Mentored junior team members and fostered a collaborative environment.\n  - Developed and deployed X, Y, and Z features using Blockchain.\n**Global Innovations** - Junior Analyst (1 years)\n  - Contributed to 4 product releases.\n  - Performed data analysis using Azure.\n\n**Education:** Bachelor's Degree in Finance from a well-regarded university."
}