{
    "id": "cf4237e4-93d3-46bc-8236-627590668e80",
    "name": "Candidate 9 from GlobalSolutions Inc.",
    "job_title": "Business Analyst",
    "industry": "Retail",
    "level": "Junior",
    "skills": [
        "Cybersecurity",
        "Machine Learning",
        "Backend Development"
    ],
    "raw_text": "Name: Candidate 9 from GlobalSolutions Inc.\nEmail: candidate.9.@example.com | Phone: (123) 555-0008\n\n**Summary:** A results-oriented and experienced Junior Business Analyst with 2 years in the Retail industry. Skilled in Cybersecurity, Machine Learning, Backend Development. Adept at analyzing complex data. strong problem-solving abilities and a collaborative mindset..\n\n**Experience:**\n**Acme Corp** - Business Analyst (1 years)\n  - Led 1 major projects, improving efficiency by 22%.\n  - Mentored junior team members and fostered a collaborative environment.\n  - Developed and deployed X, Y, and Z features using Machine Learning.\n**Global Innovations** - Associate Analyst (3 years)\n  - Contributed to 4 product releases.\n  - Performed data analysis using Machine Learning.\n\n**Education:** Bachelor's Degree in Finance from a well-regarded university."
}