{
    "id": "cf829e40-05d3-426c-a7ae-3fc0c6a2971d",
    "name": "Candidate 70 from GlobalSolutions Inc.",
    "job_title": "Director of Engineering",
    "industry": "Biotech",
    "level": "Mid",
    "skills": [
        "Sales Leadership",
        "UI/UX Design",
        "Machine Learning",
        "SQL"
    ],
    "raw_text": "Name: Candidate 70 from GlobalSolutions Inc.\nEmail: candidate.70.@example.com | Phone: (123) 555-0069\n\n**Summary:** A results-oriented and experienced Mid Director of Engineering with 4 years in the Biotech industry. Skilled in Sales Leadership, UI/UX Design, Machine Learning, SQL. Adept at building scalable systems. strong problem-solving abilities and a collaborative mindset..\n\n**Experience:**\n**Acme Corp** - Director of Engineering (3 years)\n  - Led 3 major projects, improving efficiency by 35%.\n  - Mentored junior team members and fostered a collaborative environment.\n  - Developed and deployed X, Y, and Z features using SQL.\n**Global Innovations** - Junior Engineering (3 years)\n  - Contributed to 2 product releases.\n  - Performed data analysis using Machine Learning.\n\n**Education:** Bachelor's Degree in Business Administration from a well-regarded university."
}