{
    "id": "d281b30f-1ac3-4a57-b561-898860f67f5c",
    "name": "Candidate 19 from GlobalSolutions Inc.",
    "job_title": "DevOps Engineer",
    "industry": "Automotive",
    "level": "Director",
    "skills": [
        "SAP ERP",
        "DevOps",
        "Blockchain",
        "Data Analysis",
        "UI/UX Design"
    ],
    "raw_text": "Name: Candidate 19 from GlobalSolutions Inc.\nEmail: candidate.19.@example.com | Phone: (123) 555-0018\n\n**Summary:** A results-oriented and experienced Director DevOps Engineer with 6 years in the Automotive industry. Skilled in SAP ERP, DevOps, Blockchain, Data Analysis, UI/UX Design. Adept at building scalable systems. strong problem-solving abilities and a collaborative mindset..\n\n**Experience:**\n**Acme Corp** - DevOps Engineer (5 years)\n  - Led 1 major projects, improving efficiency by 33%.\n  - Mentored junior team members and fostered a collaborative environment.\n  - Developed and deployed X, Y, and Z features using Data Analysis.\n**Global Innovations** - Junior Engineer (2 years)\n  - Contributed to 5 product releases.\n  - Performed data analysis using Data Analysis.\n\n**Education:** Bachelor's Degree in Business Administration from a well-regarded university."
}