{
    "id": "d326ddd5-ed29-48e3-a505-980fb728639a",
    "name": "Candidate 2 from GlobalSolutions Inc.",
    "job_title": "HR Business Partner",
    "industry": "Tech",
    "level": "Mid",
    "skills": [
        "Data Analysis",
        "Financial Modeling",
        "Azure",
        "Project Management",
        "Backend Development"
    ],
    "raw_text": "Name: Candidate 2 from GlobalSolutions Inc.\nEmail: candidate.2.@example.com | Phone: (123) 555-0001\n\n**Summary:** A results-oriented and experienced Mid HR Business Partner with 5 years in the Tech industry. Skilled in Data Analysis, Financial Modeling, Azure, Project Management, Backend Development. Adept at analyzing complex data. strong problem-solving abilities and a collaborative mindset..\n\n**Experience:**\n**Acme Corp** - HR Business Partner (3 years)\n  - Led 1 major projects, improving efficiency by 34%.\n  - Mentored junior team members and fostered a collaborative environment.\n  - Developed and deployed X, Y, and Z features using Project Management.\n**Global Innovations** - Junior Partner (2 years)\n  - Contributed to 5 product releases.\n  - Performed data analysis using Project Management.\n\n**Education:** Bachelor's Degree in Computer Science from a well-regarded university."
}