{
    "id": "dc2837e9-40be-46b3-ae17-4d75f71d8e2c",
    "name": "Candidate 55 from GlobalSolutions Inc.",
    "job_title": "Business Analyst",
    "industry": "Retail",
    "level": "Junior",
    "skills": [
        "Blockchain",
        "Project Management",
        "Frontend Development",
        "Data Analysis",
        "UI/UX Design",
        "SAP ERP",
        "Python",
        "HR Management"
    ],
    "raw_text": "Name: Candidate 55 from GlobalSolutions Inc.\nEmail: candidate.55.@example.com | Phone: (123) 555-0054\n\n**Summary:** A results-oriented and experienced Junior Business Analyst with 7 years in the Retail industry. Skilled in Blockchain, Project Management, Frontend Development, Data Analysis, UI/UX Design, SAP ERP, Python, HR Management. Adept at analyzing complex data. strong problem-solving abilities and a collaborative mindset..\n\n**Experience:**\n**Acme Corp** - Business Analyst (4 years)\n  - Led 3 major projects, improving efficiency by 38%.\n  - Mentored junior team members and fostered a collaborative environment.\n  - Developed and deployed X, Y, and Z features using SAP ERP.\n**Global Innovations** - Junior Analyst (3 years)\n  - Contributed to 2 product releases.\n  - Performed data analysis using UI/UX Design.\n\n**Education:** Bachelor's Degree in Engineering from a well-regarded university."
}