{
    "id": "dceccb35-c5ae-4c57-9813-bcb03e9fe5f2",
    "name": "Candidate 82 from GlobalSolutions Inc.",
    "job_title": "Product Manager",
    "industry": "Tech",
    "level": "Manager",
    "skills": [
        "Backend Development",
        "Marketing Strategy",
        "Blockchain",
        "SQL"
    ],
    "raw_text": "Name: Candidate 82 from GlobalSolutions Inc.\nEmail: candidate.82.@example.com | Phone: (123) 555-0081\n\n**Summary:** A results-oriented and experienced Manager Product Manager with 5 years in the Tech industry. Skilled in Backend Development, Marketing Strategy, Blockchain, SQL. Adept at leading cross-functional teams. strong problem-solving abilities and a collaborative mindset..\n\n**Experience:**\n**Acme Corp** - Product Manager (2 years)\n  - Led 1 major projects, improving efficiency by 34%.\n  - Mentored junior team members and fostered a collaborative environment.\n  - Developed and deployed X, Y, and Z features using Blockchain.\n**Global Innovations** - Junior Manager (3 years)\n  - Contributed to 3 product releases.\n  - Performed data analysis using Marketing Strategy.\n\n**Education:** Bachelor's Degree in Engineering from a well-regarded university."
}