{
    "id": "dedc5f10-9ede-4db1-a5fb-d02944652141",
    "name": "Candidate 101 from GlobalSolutions Inc.",
    "job_title": "VP of Sales",
    "industry": "Finance",
    "level": "Lead",
    "skills": [
        "Java",
        "Sales Leadership",
        "Cybersecurity",
        "UI/UX Design"
    ],
    "raw_text": "Name: Candidate 101 from GlobalSolutions Inc.\nEmail: candidate.101.@example.com | Phone: (123) 555-0100\n\n**Summary:** A results-oriented and experienced Lead VP of Sales with 11 years in the Finance industry. Skilled in Java, Sales Leadership, Cybersecurity, UI/UX Design. Adept at driving revenue growth. strong problem-solving abilities and a collaborative mindset..\n\n**Experience:**\n**Acme Corp** - VP of Sales (7 years)\n  - Led 2 major projects, improving efficiency by 32%.\n  - Mentored junior team members and fostered a collaborative environment.\n  - Developed and deployed X, Y, and Z features using UI/UX Design.\n**Global Innovations** - Associate Sales (1 years)\n  - Contributed to 5 product releases.\n  - Performed data analysis using Cybersecurity.\n\n**Education:** Bachelor's Degree in Computer Science from a well-regarded university."
}