{
    "id": "dffec399-5527-4558-90f3-9a403b1b176d",
    "name": "Candidate 95 from GlobalSolutions Inc.",
    "job_title": "HR Business Partner",
    "industry": "Retail",
    "level": "Manager",
    "skills": [
        "Marketing Strategy",
        "SQL",
        "Project Management",
        "Backend Development",
        "Machine Learning"
    ],
    "raw_text": "Name: Candidate 95 from GlobalSolutions Inc.\nEmail: candidate.95.@example.com | Phone: (123) 555-0094\n\n**Summary:** A results-oriented and experienced Manager HR Business Partner with 15 years in the Retail industry. Skilled in Marketing Strategy, SQL, Project Management, Backend Development, Machine Learning. Adept at analyzing complex data. strong problem-solving abilities and a collaborative mindset..\n\n**Experience:**\n**Acme Corp** - HR Business Partner (1 years)\n  - Led 1 major projects, improving efficiency by 10%.\n  - Mentored junior team members and fostered a collaborative environment.\n  - Developed and deployed X, Y, and Z features using SQL.\n**Global Innovations** - Junior Partner (1 years)\n  - Contributed to 2 product releases.\n  - Performed data analysis using SQL.\n\n**Education:** Bachelor's Degree in Marketing from a well-regarded university."
}