{
    "id": "e696849b-e9aa-49a1-9d34-080206d5ae03",
    "name": "Candidate 48 from GlobalSolutions Inc.",
    "job_title": "Sales Executive",
    "industry": "Biotech",
    "level": "Junior",
    "skills": [
        "GCP",
        "Project Management",
        "HR Management",
        "Sales Leadership",
        "Blockchain",
        "Financial Modeling",
        "Azure"
    ],
    "raw_text": "Name: Candidate 48 from GlobalSolutions Inc.\nEmail: candidate.48.@example.com | Phone: (123) 555-0047\n\n**Summary:** A results-oriented and experienced Junior Sales Executive with 8 years in the Biotech industry. Skilled in GCP, Project Management, HR Management, Sales Leadership, Blockchain, Financial Modeling, Azure. Adept at driving revenue growth. strong problem-solving abilities and a collaborative mindset..\n\n**Experience:**\n**Acme Corp** - Sales Executive (2 years)\n  - Led 1 major projects, improving efficiency by 40%.\n  - Mentored junior team members and fostered a collaborative environment.\n  - Developed and deployed X, Y, and Z features using Financial Modeling.\n**Global Innovations** - Junior Executive (3 years)\n  - Contributed to 4 product releases.\n  - Performed data analysis using Sales Leadership.\n\n**Education:** Bachelor's Degree in Finance from a well-regarded university."
}