{
    "id": "e966ca2f-c31d-47f1-89fb-bf0c35cabc82",
    "name": "Candidate 75 from GlobalSolutions Inc.",
    "job_title": "VP of Sales",
    "industry": "Retail",
    "level": "Mid",
    "skills": [
        "Python",
        "SAP ERP",
        "AWS",
        "SQL",
        "Salesforce CRM"
    ],
    "raw_text": "Name: Candidate 75 from GlobalSolutions Inc.\nEmail: candidate.75.@example.com | Phone: (123) 555-0074\n\n**Summary:** A results-oriented and experienced Mid VP of Sales with 14 years in the Retail industry. Skilled in Python, SAP ERP, AWS, SQL, Salesforce CRM. Adept at driving revenue growth. strong problem-solving abilities and a collaborative mindset..\n\n**Experience:**\n**Acme Corp** - VP of Sales (4 years)\n  - Led 2 major projects, improving efficiency by 34%.\n  - Mentored junior team members and fostered a collaborative environment.\n  - Developed and deployed X, Y, and Z features using Python.\n**Global Innovations** - Junior Sales (2 years)\n  - Contributed to 5 product releases.\n  - Performed data analysis using AWS.\n\n**Education:** Bachelor's Degree in Computer Science from a well-regarded university."
}