{
    "id": "e9ab9c2e-1561-405f-a7cf-887ca0f17c50",
    "name": "Candidate 38 from GlobalSolutions Inc.",
    "job_title": "UX Designer",
    "industry": "Tech",
    "level": "Junior",
    "skills": [
        "Python",
        "UI/UX Design",
        "AWS",
        "Blockchain",
        "Machine Learning"
    ],
    "raw_text": "Name: Candidate 38 from GlobalSolutions Inc.\nEmail: candidate.38.@example.com | Phone: (123) 555-0037\n\n**Summary:** A results-oriented and experienced Junior UX Designer with 9 years in the Tech industry. Skilled in Python, UI/UX Design, AWS, Blockchain, Machine Learning. Adept at analyzing complex data. strong problem-solving abilities and a collaborative mindset..\n\n**Experience:**\n**Acme Corp** - UX Designer (7 years)\n  - Led 1 major projects, improving efficiency by 32%.\n  - Mentored junior team members and fostered a collaborative environment.\n  - Developed and deployed X, Y, and Z features using Python.\n**Global Innovations** - Junior Designer (3 years)\n  - Contributed to 4 product releases.\n  - Performed data analysis using Python.\n\n**Education:** Bachelor's Degree in Finance from a well-regarded university."
}