{
    "id": "e9f0e659-527c-4c9d-b7a7-a5f38b712560",
    "name": "Candidate 60 from GlobalSolutions Inc.",
    "job_title": "Product Manager",
    "industry": "Consulting",
    "level": "Senior",
    "skills": [
        "UI/UX Design",
        "Frontend Development",
        "DevOps",
        "GCP",
        "Sales Leadership",
        "Salesforce CRM"
    ],
    "raw_text": "Name: Candidate 60 from GlobalSolutions Inc.\nEmail: candidate.60.@example.com | Phone: (123) 555-0059\n\n**Summary:** A results-oriented and experienced Senior Product Manager with 12 years in the Consulting industry. Skilled in UI/UX Design, Frontend Development, DevOps, GCP, Sales Leadership, Salesforce CRM. Adept at leading cross-functional teams. strong problem-solving abilities and a collaborative mindset..\n\n**Experience:**\n**Acme Corp** - Product Manager (2 years)\n  - Led 3 major projects, improving efficiency by 11%.\n  - Mentored junior team members and fostered a collaborative environment.\n  - Developed and deployed X, Y, and Z features using DevOps.\n**Global Innovations** - Associate Manager (3 years)\n  - Contributed to 5 product releases.\n  - Performed data analysis using Salesforce CRM.\n\n**Education:** Bachelor's Degree in Engineering from a well-regarded university."
}