{
    "id": "ea2399a3-82fe-42a0-b4ec-1b1ff7cbdd75",
    "name": "Candidate 36 from GlobalSolutions Inc.",
    "job_title": "Data Scientist",
    "industry": "Biotech",
    "level": "Manager",
    "skills": [
        "Machine Learning",
        "UI/UX Design",
        "SQL",
        "DevOps"
    ],
    "raw_text": "Name: Candidate 36 from GlobalSolutions Inc.\nEmail: candidate.36.@example.com | Phone: (123) 555-0035\n\n**Summary:** A results-oriented and experienced Manager Data Scientist with 15 years in the Biotech industry. Skilled in Machine Learning, UI/UX Design, SQL, DevOps. Adept at analyzing complex data. strong problem-solving abilities and a collaborative mindset..\n\n**Experience:**\n**Acme Corp** - Data Scientist (5 years)\n  - Led 3 major projects, improving efficiency by 26%.\n  - Mentored junior team members and fostered a collaborative environment.\n  - Developed and deployed X, Y, and Z features using DevOps.\n**Global Innovations** - Junior Scientist (1 years)\n  - Contributed to 3 product releases.\n  - Performed data analysis using SQL.\n\n**Education:** Bachelor's Degree in Marketing from a well-regarded university."
}