{
    "id": "ed996300-5a12-4d7f-b6ac-482b751cef9c",
    "name": "Candidate 63 from GlobalSolutions Inc.",
    "job_title": "HR Business Partner",
    "industry": "Healthcare",
    "level": "Lead",
    "skills": [
        "Frontend Development",
        "Python",
        "Sales Leadership",
        "SQL"
    ],
    "raw_text": "Name: Candidate 63 from GlobalSolutions Inc.\nEmail: candidate.63.@example.com | Phone: (123) 555-0062\n\n**Summary:** A results-oriented and experienced Lead HR Business Partner with 2 years in the Healthcare industry. Skilled in Frontend Development, Python, Sales Leadership, SQL. Adept at analyzing complex data. strong problem-solving abilities and a collaborative mindset..\n\n**Experience:**\n**Acme Corp** - HR Business Partner (1 years)\n  - Led 2 major projects, improving efficiency by 31%.\n  - Mentored junior team members and fostered a collaborative environment.\n  - Developed and deployed X, Y, and Z features using Python.\n**Global Innovations** - Associate Partner (3 years)\n  - Contributed to 4 product releases.\n  - Performed data analysis using SQL.\n\n**Education:** Bachelor's Degree in Computer Science from a well-regarded university."
}