{
    "id": "f41dc350-ef20-4a7b-aecc-62c9356d6af4",
    "name": "Candidate 24 from GlobalSolutions Inc.",
    "job_title": "Product Manager",
    "industry": "E-commerce",
    "level": "Junior",
    "skills": [
        "Python",
        "Backend Development",
        "Java",
        "HR Management",
        "Financial Modeling"
    ],
    "raw_text": "Name: Candidate 24 from GlobalSolutions Inc.\nEmail: candidate.24.@example.com | Phone: (123) 555-0023\n\n**Summary:** A results-oriented and experienced Junior Product Manager with 8 years in the E-commerce industry. Skilled in Python, Backend Development, Java, HR Management, Financial Modeling. Adept at leading cross-functional teams. strong problem-solving abilities and a collaborative mindset..\n\n**Experience:**\n**Acme Corp** - Product Manager (2 years)\n  - Led 1 major projects, improving efficiency by 21%.\n  - Mentored junior team members and fostered a collaborative environment.\n  - Developed and deployed X, Y, and Z features using Python.\n**Global Innovations** - Associate Manager (1 years)\n  - Contributed to 2 product releases.\n  - Performed data analysis using Python.\n\n**Education:** Bachelor's Degree in Business Administration from a well-regarded university."
}