{
    "id": "f63b0602-1084-434f-b099-31dcbe0e9a55",
    "name": "Candidate 65 from GlobalSolutions Inc.",
    "job_title": "Software Engineer",
    "industry": "Biotech",
    "level": "Junior",
    "skills": [
        "GCP",
        "Python",
        "Marketing Strategy",
        "Frontend Development",
        "Data Analysis",
        "Machine Learning",
        "Salesforce CRM",
        "HR Management"
    ],
    "raw_text": "Name: Candidate 65 from GlobalSolutions Inc.\nEmail: candidate.65.@example.com | Phone: (123) 555-0064\n\n**Summary:** A results-oriented and experienced Junior Software Engineer with 4 years in the Biotech industry. Skilled in GCP, Python, Marketing Strategy, Frontend Development, Data Analysis, Machine Learning, Salesforce CRM, HR Management. Adept at building scalable systems. strong problem-solving abilities and a collaborative mindset..\n\n**Experience:**\n**Acme Corp** - Software Engineer (2 years)\n  - Led 3 major projects, improving efficiency by 32%.\n  - Mentored junior team members and fostered a collaborative environment.\n  - Developed and deployed X, Y, and Z features using Frontend Development.\n**Global Innovations** - Junior Engineer (3 years)\n  - Contributed to 5 product releases.\n  - Performed data analysis using Marketing Strategy.\n\n**Education:** Bachelor's Degree in Finance from a well-regarded university."
}