{
    "id": "f670787b-1b67-4dc6-bf46-4d62e8b0b64e",
    "name": "Candidate 30 from GlobalSolutions Inc.",
    "job_title": "Software Engineer",
    "industry": "Consulting",
    "level": "Manager",
    "skills": [
        "Salesforce CRM",
        "UI/UX Design",
        "SQL"
    ],
    "raw_text": "Name: Candidate 30 from GlobalSolutions Inc.\nEmail: candidate.30.@example.com | Phone: (123) 555-0029\n\n**Summary:** A results-oriented and experienced Manager Software Engineer with 3 years in the Consulting industry. Skilled in Salesforce CRM, UI/UX Design, SQL. Adept at building scalable systems. strong problem-solving abilities and a collaborative mindset..\n\n**Experience:**\n**Acme Corp** - Software Engineer (1 years)\n  - Led 1 major projects, improving efficiency by 35%.\n  - Mentored junior team members and fostered a collaborative environment.\n  - Developed and deployed X, Y, and Z features using Salesforce CRM.\n**Global Innovations** - Junior Engineer (1 years)\n  - Contributed to 3 product releases.\n  - Performed data analysis using SQL.\n\n**Education:** Bachelor's Degree in Finance from a well-regarded university."
}