{
    "id": "fce80505-ebae-4e65-938a-43a7530e070b",
    "name": "Candidate 94 from GlobalSolutions Inc.",
    "job_title": "Data Scientist",
    "industry": "Automotive",
    "level": "Lead",
    "skills": [
        "SAP ERP",
        "Blockchain",
        "SQL",
        "Data Analysis",
        "Product Management",
        "Java"
    ],
    "raw_text": "Name: Candidate 94 from GlobalSolutions Inc.\nEmail: candidate.94.@example.com | Phone: (123) 555-0093\n\n**Summary:** A results-oriented and experienced Lead Data Scientist with 9 years in the Automotive industry. Skilled in SAP ERP, Blockchain, SQL, Data Analysis, Product Management, Java. Adept at analyzing complex data. strong problem-solving abilities and a collaborative mindset..\n\n**Experience:**\n**Acme Corp** - Data Scientist (7 years)\n  - Led 1 major projects, improving efficiency by 16%.\n  - Mentored junior team members and fostered a collaborative environment.\n  - Developed and deployed X, Y, and Z features using Data Analysis.\n**Global Innovations** - Junior Scientist (3 years)\n  - Contributed to 4 product releases.\n  - Performed data analysis using Product Management.\n\n**Education:** Bachelor's Degree in Engineering from a well-regarded university."
}