{
    "id": "fd8f0844-e03b-46d7-9752-dfb36a029f35",
    "name": "Candidate 14 from GlobalSolutions Inc.",
    "job_title": "Director of Engineering",
    "industry": "Consulting",
    "level": "Mid",
    "skills": [
        "Frontend Development",
        "Backend Development",
        "Blockchain",
        "Data Analysis"
    ],
    "raw_text": "Name: Candidate 14 from GlobalSolutions Inc.\nEmail: candidate.14.@example.com | Phone: (123) 555-0013\n\n**Summary:** A results-oriented and experienced Mid Director of Engineering with 14 years in the Consulting industry. Skilled in Frontend Development, Backend Development, Blockchain, Data Analysis. Adept at building scalable systems. strong problem-solving abilities and a collaborative mindset..\n\n**Experience:**\n**Acme Corp** - Director of Engineering (11 years)\n  - Led 3 major projects, improving efficiency by 37%.\n  - Mentored junior team members and fostered a collaborative environment.\n  - Developed and deployed X, Y, and Z features using Data Analysis.\n**Global Innovations** - Associate Engineering (2 years)\n  - Contributed to 4 product releases.\n  - Performed data analysis using Data Analysis.\n\n**Education:** Bachelor's Degree in Business Administration from a well-regarded university."
}