{
    "id": "fd9c7c13-6cdd-4c52-a098-32bf19fbc768",
    "name": "Candidate 11 from GlobalSolutions Inc.",
    "job_title": "Director of Engineering",
    "industry": "Biotech",
    "level": "Lead",
    "skills": [
        "Java",
        "Frontend Development",
        "AWS",
        "Marketing Strategy",
        "Data Analysis",
        "UI/UX Design",
        "Backend Development"
    ],
    "raw_text": "Name: Candidate 11 from GlobalSolutions Inc.\nEmail: candidate.11.@example.com | Phone: (123) 555-0010\n\n**Summary:** A results-oriented and experienced Lead Director of Engineering with 6 years in the Biotech industry. Skilled in Java, Frontend Development, AWS, Marketing Strategy, Data Analysis, UI/UX Design, Backend Development. Adept at building scalable systems. strong problem-solving abilities and a collaborative mindset..\n\n**Experience:**\n**Acme Corp** - Director of Engineering (4 years)\n  - Led 3 major projects, improving efficiency by 21%.\n  - Mentored junior team members and fostered a collaborative environment.\n  - Developed and deployed X, Y, and Z features using Data Analysis.\n**Global Innovations** - Associate Engineering (3 years)\n  - Contributed to 3 product releases.\n  - Performed data analysis using Frontend Development.\n\n**Education:** Bachelor's Degree in Engineering from a well-regarded university."
}