{
    "id": "fea34f17-4752-411d-afe1-f6e1c0ab8d60",
    "name": "Candidate 58 from GlobalSolutions Inc.",
    "job_title": "HR Business Partner",
    "industry": "Automotive",
    "level": "Mid",
    "skills": [
        "Python",
        "Sales Leadership",
        "HR Management",
        "Cybersecurity",
        "Financial Modeling"
    ],
    "raw_text": "Name: Candidate 58 from GlobalSolutions Inc.\nEmail: candidate.58.@example.com | Phone: (123) 555-0057\n\n**Summary:** A results-oriented and experienced Mid HR Business Partner with 8 years in the Automotive industry. Skilled in Python, Sales Leadership, HR Management, Cybersecurity, Financial Modeling. Adept at analyzing complex data. strong problem-solving abilities and a collaborative mindset..\n\n**Experience:**\n**Acme Corp** - HR Business Partner (2 years)\n  - Led 2 major projects, improving efficiency by 24%.\n  - Mentored junior team members and fostered a collaborative environment.\n  - Developed and deployed X, Y, and Z features using Sales Leadership.\n**Global Innovations** - Junior Partner (2 years)\n  - Contributed to 4 product releases.\n  - Performed data analysis using Sales Leadership.\n\n**Education:** Bachelor's Degree in Computer Science from a well-regarded university."
}