{
    "id": "ff181ea5-ed73-49b7-b78c-2658264932cf",
    "name": "Candidate 20 from GlobalSolutions Inc.",
    "job_title": "Business Analyst",
    "industry": "Finance",
    "level": "Director",
    "skills": [
        "Financial Modeling",
        "SAP ERP",
        "Project Management",
        "Azure"
    ],
    "raw_text": "Name: Candidate 20 from GlobalSolutions Inc.\nEmail: candidate.20.@example.com | Phone: (123) 555-0019\n\n**Summary:** A results-oriented and experienced Director Business Analyst with 15 years in the Finance industry. Skilled in Financial Modeling, SAP ERP, Project Management, Azure. Adept at analyzing complex data. strong problem-solving abilities and a collaborative mindset..\n\n**Experience:**\n**Acme Corp** - Business Analyst (9 years)\n  - Led 1 major projects, improving efficiency by 19%.\n  - Mentored junior team members and fostered a collaborative environment.\n  - Developed and deployed X, Y, and Z features using Azure.\n**Global Innovations** - Junior Analyst (3 years)\n  - Contributed to 2 product releases.\n  - Performed data analysis using Project Management.\n\n**Education:** Bachelor's Degree in Computer Science from a well-regarded university."
}